"Hash","NodeName","PL"
"FD88C71A4FD6BEF963B253B5588C565C","lw_pw01_readable","Pognieciona depesza"
"C001EC8A41D902072136A898160C8565","lw_pw01_readable","W związku z sytuacją na Powiślu STOP Wymagam od Pana natychmiastowych postępów STOP W razie ich braku zostaje Pan zdegradowany i odsunięty od śledztwa STOP płk. Siergiej Buriatow"
"0DDB8143413AEA86638FC6B42AA063CF","lw_pw01_readable","Wezwanie na komisariat"
"FB9A397B46E11277C8CA69B432FA8188","lw_pw01_readable","Ponownie wzywa się Pana Kajetana Chruścickiego do osobistego stawiennictwa na posterunku głównym policji na Śródmieściu. W razie zignorowania wezwania, komisarz prowadzący Pielewin zostanie upoważniony do przedsięwzięcia środków przymusu bezpośredniego, mających na celu zmuszenie Pana do spełnienia jego obowiązku względem organów ścigania. Proszę potraktować ten dokument jako ostateczne ponaglenie."
"1C34AD2E4272B5E9815FBFAB4C261413","lw_pw01_readable","Wczorajsza gazeta"
"E82F9BB54D7CDAB09DC1BC886E7BC980","lw_pw01_readable","Rybak atakuje. Policja jest bezradna

Morderca, nazywany przez mieszkańców Powiśla Rybakiem, znowu uderza.
Okrutnie okaleczone zwłoki, zostały znalezione wczesnym rankiem, na lokalnej plaży przez Marcelego Okrasę, wędkarza z Powiśla: - W życiu nie widziałem tak okaleczonego ciała - powiedział nam Pan Okrasa - tego nie mógł zrobić człowiek. To musiał być diabeł.
Policja wstrzymuje się od komentarza w tej sprawie. Nie jest to zaskakujące, zważywszy że mimo ciągnącego się tygodniami dochodzenia, sprawca wciąż pozostaje nieuchwytny. Służby zawodzą. Po raz kolejny."
"BFF6EBBD4F14089B774AEEA31D048595","lw_pw01_readable","Starsza gazeta"
"704564C64D97B21112FCC3BB72ECAAF6","lw_pw01_readable","Kolejna ŚMIERĆ NA POWIŚLU!
RYBAK znów zaatakował!

Morderca, który ostatnio sieje postrach wśród mieszkańców Powiśla, wciąż pozostaje nieuchwytny i zdaje się jawnie kpić z wysiłków policji. W poniedziałek rano na brzegu Wisły kilkoro miejscowych podrostków odnalazło kolejne ciało: mężczyznę lat około trzydziestu. Charakterystyczne obrażenia nie pozostawiają wątpliwości, kim jest autor tego makabrycznego dzieła. 
Każdy, kto posiada jakiekolwiek informacje mogące pomóc w pochwyceniu zabójcy, jest proszony o niezwłoczne zgłoszenie się na najbliższy komisariat. "
