"Hash","NodeName","PL","TR","Notes"
"BB5BDF354F471DDEDD8A6896E3959305","lw_POI_SMG_massage","Brutalna sesja terapeutyczna","Vahşi Tedavi Seansı","Başlık"
"7FCE246548375D597FD11DAFCE32E822","lw_POI_SMG_massage","Znalazłem tajemniczą kartkę. Czuję, że jeśli podrążę nieco w tym temacie, wpadnę na trop czegoś ciekawego.","Esrarengiz bir kart buldum. Bu konuyu biraz kurcalarsam ilginç bir şeyin izine düşeceğim hissediyorum.",""
"DEF0C5514D74177EB15A05A3B270D322","lw_POI_SMG_massage","Czy ten wychwalany doktor poradzi sobie z moimi ostatnimi urazami? Spróbuję, w końcu w zdrowym ciele - zdrowy duch.","Bu göklere çıkarılan doktor son sakatlıklarımın üstesinden gelir mi acaba? Deneyeceğim — sağlıklı bedende sağlıklı ruh derler.",""
"91210E514C3B7D1A390D79AC4E1C555C","lw_POI_SMG_massage","Rozejrzyj się po Warszawie i poszukaj wskazówek","Varşova'da etrafa bakın ve ipuçları ara","Quest objective"
"8116474B48842D5CB839108A28DE2635","lw_POI_SMG_massage","Wypróbuj po południu masaż u doktora Jasińskiego na Plebańskiej 4/7","Öğleden sonra Plebańska 4/7'deki Doktor Jasiński'de masajı dene",""
