"Hash","NodeName","PL","TR","Notes"
"E3F5AD3545D7497AE99D5DB83B448AB2","lw_POI_BZR_secretLibrary","Sekretna biblioteka","Gizli Kütüphane","Başlık"
"B9FFC0274DA2951916BB1FB771BCE48C","lw_POI_BZR_secretLibrary","Natrafiłem na nietypowy, zgubiony przedmiot. Sprawdźmy, do czego doprowadzi mnie małe śledztwo w tej sprawie.","Sıra dışı, kaybedilmiş bir eşyaya rastladım. Küçük bir soruşturmanın beni nereye götüreceğini görelim.",""
"1CE7088D43EBF80D85604F9095F433FF","lw_POI_BZR_secretLibrary","Odkryłem, że zgubiona paczka należy do niejakiego Bałuckiego - amatora książek zakazanych przez cenzurę. Spróbuję dostać się do jego tajnej biblioteki.","Kayıp paketin, sansürün yasakladığı kitaplara meraklı Bałucki adlı birine ait olduğunu keşfettim. Gizli kütüphanesine girmeyi deneyeceğim.",""
"F42CC54D40CB4EE7E19AD882CC26D7F3","lw_POI_BZR_secretLibrary","Odkryj sekret związany ze zgubą","Kayıpla ilgili sırrı ortaya çıkar","Quest objective"
"52513C1741AC6A46FA136CA090B49615","lw_POI_BZR_secretLibrary","Odwiedź Bałuckiego na Targowej 29a","Bałucki'yi Targowa 29a'da ziyaret et",""
