"Hash","NodeName","PL","TR","Notes"
"CCBC5B5D4EF9C59038A059A979B0B137","lw_POI_SMG_countParty","Orientalne przyjęcie u hrabiego","Kontun Doğulu Daveti","Başlık"
"BD040FE44EE1EBC9888D7E9014A5AFCD","lw_POI_SMG_countParty","Znalazłem karteczkę, której treść brzmi intrygująco... Czuję, że kryje się za tym jakiś sekret wart zbadania. ","İçeriği merak uyandıran bir not buldum… Ardında incelemeye değer bir sırrın saklandığını hissediyorum. ",""
"92020D134970F50B046F14BEFE9F5B0A","lw_POI_SMG_countParty","Tajemnica przyjęcia u hrabiego rozwiązana - mam już adres, nazwisko oraz tajne hasło. Może warto złożyć wizytę gospodarzowi i sprawdzić, co się tam dzieje. Oczywiście tylko w ramach eksperymentu i naukowej dociekliwości.","Kontun davetinin sırrı çözüldü — adres, isim ve gizli parola elimde. Ev sahibini ziyaret edip orada neler döndüğüne bakmaya değer. Elbette yalnızca deney ve bilimsel merak amacıyla.",""
"D3A0F4C6440F5F7AA3AD4DB41A9C07B5","lw_POI_SMG_countParty","Poszukaj wskazówek związanych z tajemniczą notatką ","Esrarengiz notla bağlantılı ipuçları ara ","Quest objective"
"074FB0B0471DB864FF935ABC30B47322","lw_POI_SMG_countParty","Odwiedź hrabiego na Erywańskiej 15 po południu","Kontu öğleden sonra Erywańska 15'te ziyaret et",""
