"Hash","NodeName","PL","TR","Notes"
"8EC253AC48C70041C55A00AD6DEC4F7C","CinematicNode_Choice_0","Ujawnij, że masz dokumenty Dicksteina.","Dickstein'ın belgelerinin sende olduğunu açıkla.",""
"405AFCBB4EA1CB2876BDE487CFE7BFAA","CinematicNode_Choice_0","Zderz je z gorzką prawdą. To koniec.","Onları acı gerçekle yüz yüze getir. Bu son.",""
"8417E1924659D75E937776A2216B3F65","CinematicNode_Choice_0","Oddaj głos Ligii.","Sözü Ligia'ya bırak.",""
"7DFC408C48C3764B46A93F9D01FF8B49","CinematicNode_Choice_0","Zasugeruj znalezienie kryjówki.","Saklanacak bir yer bulmayı öner.",""
"F997F748431F13741B0C81BF8B5B6DA3","CinematicNode_Choice_0","1","1",""
"ED2E9E8546F2183852F6338EFBE28087","CinematicNode_Choice_0","2","2",""
"0D8AA6D8483AAE22454F44A877747163","CinematicNode_Choice_0","3","3",""
"33776E9D4CE28CAD45733E8571A913B3","CinematicNode_Choice_0","4","4",""
"BCF5C42E4121DCE386EDE2B045794DDF","CinematicNode_Choice_1","Ujawnij, że masz dokumenty Dicksteina.","Dickstein'ın belgelerinin sende olduğunu açıkla.",""
"E544D74942CDA749424608A88B178B97","CinematicNode_Choice_1","Życz wam wszystkim powodzenia.","Hepsine iyi şanslar dile.",""
"5CC61E2D451D69BA777038B36BADA29B","CinematicNode_Choice_1","Ponaglij je, czas kończyć.","Onları sıkıştır, bitirme vakti.",""
"D4FC9D0E4049B506717FC7B3813CD1CB","CinematicNode_Choice_1","1","1",""
"CEFACE034839A1F78BD78BAF0887F139","CinematicNode_Choice_1","2","2",""
"8A7CE2D243F0B53ED73B548C4440B16F","CinematicNode_Choice_1","3","3",""
"163BA33747C147583FEAF7935C48A046","CinematicNode_Choice_2","Powiedz, że to nie koniec, tylko przerwa.","Bunun son değil, bir ara olduğunu söyle.",""
"BFF1ADD148A70205A9DCE2B3EFDF5160","CinematicNode_Choice_2","Poradź, żeby znaleźli sobie dobrą kryjówkę.","İyi bir sığınak bulmalarını öner.",""
"E6EC976D4C01C91AC3CC599B532C0AF4","CinematicNode_Choice_2","Pozwól im debatować.","Tartışsınlar, bırak.",""
"6F80DB3244B5B4F91679D1AB0EEAC877","CinematicNode_Choice_2","1","1",""
"71663C0D4DB4F418268DBF9E6D9383EE","CinematicNode_Choice_2","2","2",""
"179DDCB1461F41034710B68392CD2BD0","CinematicNode_Choice_2","3","3",""
"082DC9064A5E672F021EA9BB1DB054EB","CinematicNode_Choice_3","Wyjaśnij Dicksteinowi, co mają na myśli.","Dickstein'a ne demek istediklerini açıkla.",""
"FDC3F5E843981F25AEAFFA8D0F18ED06","CinematicNode_Choice_3","Nic nie mów.","Bir şey söyleme.",""
"83B52D8F4D1F5393573CAA88777DA015","CinematicNode_Choice_3","Zauważ, że czas kończyć.","Bitirme vakti olduğunu belirt.",""
"0DADA0DC489C908C8AA33296C714A647","CinematicNode_Choice_3","1","1",""
"58D42D1F43A6419311D47E84DFF32F50","CinematicNode_Choice_3","2","2",""
"F7332549441EAC91D5D5C3B906457F08","CinematicNode_Choice_3","3","3",""
"04391FE44EFBFB6AA387BFB796697CFC","CinematicNode_Response_0","Zaczynamy?","Başlayalım mı?",""
"F1A5104F4F719AF7C0BB209EFE2C608E","CinematicNode_Response_0","Tak, chyba są już wszyscy, których zdołaliśmy ostrzec.","Evet, uyarabildiğimiz herkes burada sanırım.",""
"01A8C22F45EC5F98D7F12188416054BD","CinematicNode_Response_0","Moi drodzy, nie mógłbym być bardziej dumny, że byłem częścią tego przedsięwzięcia i nie może mi być bardziej przykro, że to już koniec.","Sevgili dostlarım, bu girişimin bir parçası olduğum için bundan daha gururlu olamazdım ve sona erdiği için bundan daha üzgün olamam.","Dickstein belirmiş"
"4B21BEE34E8AF3AF6FDDB288BFCDE0E8","CinematicNode_Response_0","Co? Jak to panie przewodniczący!?","Ne? Nasıl olur sayın başkan!?",""
"FD63A0A84470A8E0BB97BF834456010F","CinematicNode_Response_0","W obliczu aresztowań i całego niebezpieczeństwa, jakie na wszystkich sprowadziłem, nie widzę jednak innego wyjścia.","Tutuklamalar ve herkesin başına getirdiğim tehlike karşısında başka çıkar yol göremiyorum.",""
"73974C5541731FDF924E608FA7FB3C13","CinematicNode_Response_0","Zamykam Uniwersytet Latający. Dla waszego bezpieczeństwa.","Uçan Üniversite'yi kapatıyorum. Sizin güvenliğiniz için.",""
"A31198E3451578CABC81598A51557948","CinematicNode_Response_1","Chyba powinniśmy już zaczynać.","Artık başlamamız lazım sanırım.",""
"83119E3743218EE4B7CC03B093FC7270","CinematicNode_Response_10","Co myślisz, siostro?","Sen ne diyorsun, kardeşim?","Wiktor → Ligia"
"413182624FD8E79D965189BF2307B2DF","CinematicNode_Response_11","Sugeruję znaleźć jakąś bezpieczną kryjówkę i przeczekać to zamieszanie.","Güvenli bir sığınak bulup bu kargaşayı atlatmayı öneriyorum.",""
"9600880A44DB59E25B5DA194093383FE","CinematicNode_Response_13","Tak. Trzeba przeczekać, owszem, ale zrezygnować? Nigdy.","Evet. Beklemek gerek, doğru, ama vazgeçmek? Asla.",""
"A49682704DD21D87AC8A97B902AB73FF","CinematicNode_Response_14","Cóż. Może w takim razie to okaże się pomocne.","Eh. Öyleyse belki bu işe yarar.",""
"5E9B42804C9E87AF23D2E288A9D85FC1","CinematicNode_Response_15","Powodzenia. Mam nadzieję, że ta wola walki nie zostanie szybko ugaszona.","İyi şanslar. Umarım bu mücadele azmi çabuk sönmez.",""
"AE8F16714BB93C6A7069B8A4DA8AABED","CinematicNode_Response_16","Tak, nie kuśmy już losu.","Evet, artık talihi zorlamayalım.",""
"8D7BEFF549342D041D53FBA3B85A16D5","CinematicNode_Response_16","Bez pana, nie byłoby nas tutaj. To jeszcze nie koniec, do zobaczenia.","Siz olmasaydınız biz burada olmazdık. Bu son değil, görüşmek üzere.",""
"7415930F47FBFACBD7C31389862E4BBA","CinematicNode_Response_17","Tylko wtedy ofiara tych, którzy zostali aresztowani, nie pójdzie na marne.","Ancak o zaman tutuklananların fedakârlığı boşa gitmez.",""
"BB4955BE49D8060432B12AB27FA76BBA","CinematicNode_Response_17","Nie możemy się poddawać.","Vazgeçemeyiz.",""
"A0B1EC39466A916295B9A08ACB407A04","CinematicNode_Response_18","Mam nadzieję, że kiedyś spotkamy się jeszcze w dobrym zdrowiu i wolni.","Umarım bir gün sağ ve özgür olarak yeniden buluşuruz.",""
"CE77515B46C5A91CE4620DB7C832E9F4","CinematicNode_Response_18","Tymczasem, jestem zmuszony nalegać, abyśmy skończyli to zebranie.","Şimdilik bu toplantıyı sonlandırmamızda ısrar etmek zorundayım.",""
"CBA4AC2D48FE36A83B055B83C9058431","CinematicNode_Response_19","Obawiam się, że czas nas jednak nagli.","Korkarım vakit bizi sıkıştırıyor.",""
"8623131441AF48BABC2DA0948DFEF924","CinematicNode_Response_2","Samuel nie przyjdzie. Powinien być już w drodze do Wiednia.","Samuel gelmeyecek. Şimdiye Viyana yolunda olmalı.",""
"A0F0D7BC4CC9D407CF56EB9DD68EE902","CinematicNode_Response_2","Tak bez słowa? Nie wierzę, że zrobiłby coś takiego. Zostawił nas, tak po prostu?","Tek kelime etmeden mi? Böyle bir şey yapacağına inanamıyorum. Bizi öylece bıraktı mı?",""
"B9C5E30C4016DE15461F81828EDCA1EC","CinematicNode_Response_20","Może nie nazywajmy tego końcem, a przerwą?","Buna son demeyip bir ara diyelim belki?",""
"973E3D054351F630791A33BB1EA00002","CinematicNode_Response_20","Nie, nazywajmy rzeczy po imieniu. Tak będzie lepiej dla nas wszystkich.","Hayır, açıkça adını koyalım. Hepimiz için böylesi daha iyi olur.",""
"CF44B08C4314DDD44A9925939372C3DE","CinematicNode_Response_21","Sugeruję wszystkim znaleźć bezpieczną kryjówkę i przeczekać to zamieszanie.","Herkese güvenli bir sığınak bulup bu kargaşayı atlatmayı öneriyorum.",""
"5DDA2B1D4972DA3939ECF1ACC58455D6","CinematicNode_Response_21","Posłuchajcie, najważniejsze, to przeżyć. W razie, gdyby ktoś was złapał i przesłuchiwał, nie musicie mnie kryć. Nie warto się tak narażać.","Beni dinleyin, en önemlisi hayatta kalmak. Biri sizi yakalayıp sorgularsa beni korumak zorunda değilsiniz. Bu kadar risk almaya değmez.",""
"53E0B1BE460C0AFDFADB5683F50EBF57","CinematicNode_Response_22","Obawiam się, że tak.","Korkarım ki öyle.",""
"C851034A4450CF0FB205C0B5D3ACC749","CinematicNode_Response_23","Wtedy wszystkie z nas... Wszyscy, którzy zostali aresztowani, ich ofiara pójdzie na marne.","O zaman hepimiz… Tutuklananların hepsinin fedakârlığı boşa gider.",""
"5162D2FB4698BC6827119FB3DDCE0492","CinematicNode_Response_23","O czym wy mówicie?","Ne konuşuyorsunuz?","Dickstein"
"069505754A81DEC02A1E75AFB534B7A7","CinematicNode_Response_24","Obawiam się, że na teraz musimy zakończyć tę debatę. Ochrana w końcu znajdzie i to miejsce.","Korkarım şimdilik bu tartışmayı sonlandırmamız gerek. Ochrana burayı da eninde sonunda bulacak.",""
"AE044D7146DCBE46AEC72FA947C96819","CinematicNode_Response_24","Tak, już wiemy, co mamy robić.","Evet, ne yapacağımızı artık biliyoruz.",""
"35BC4148436E66D0A7BCAAB93D043E81","CinematicNode_Response_24","Przeczekać gorączkę, która trawi miasto.","Şehri yakıp kavuran ateşin geçmesini beklemek.",""
"9A1F85164355CD12C76247B51A49262D","CinematicNode_Response_25","Mówimy o tym Samuelu, że trzeba się przyczaić i przeczekać.","Samuel, gizlenip beklememiz gerektiğinden söz ediyoruz.",""
"E39B82F547D555636A78149DD9F6F01E","CinematicNode_Response_26","Chciały przez to powiedzieć, że...","Şunu söylemek istediler ki…",""
"79680C884C48A844E60140A3A2ED9B64","CinematicNode_Response_27","A potem spróbować znowu. Do skutku.","Sonra yeniden denemek. Sonuç alana kadar.",""
"650CF60348841BE88307CEAEEBAEC398","CinematicNode_Response_27","Rozumiem. Dziękuję. Za wszystko.","Anlıyorum. Her şey için teşekkür ederim.",""
"AA1B0B4F46818FE16035889A2DE2A96B","CinematicNode_Response_27","Mimo, że niektórzy chcieliby nas uciszyć, wierzę, że wkrótce nasz los się odmieni. Cierpliwości.","Bazıları bizi susturmak istese de, yakında kaderimizin değişeceğine inanıyorum. Sabır.",""
"5055FA564E579CCCACC11D93C87A9268","CinematicNode_Response_27","A tymczasem, uważajcie na siebie. Dziękuję raz jeszcze.","Ve şimdilik kendinize dikkat edin. Yeniden teşekkür ederim.",""
"0AE83F484EE1D058A33604844584DCCC","CinematicNode_Response_28","Nie można się poddawać. Zawsze braliśmy pod uwagę, że ten dzień może nadejść.","Vazgeçilmez. Bu günün gelebileceğini hep hesaba kattık.",""
"3C5D11194C159656821628BEB04D1C6E","CinematicNode_Response_29","Ja mu wyjaśnię.","Ona ben açıklarım.",""
"96CC3A8148989E5E970027A91A110363","CinematicNode_Response_3","To co powinniśmy teraz zrobić?","Peki şimdi ne yapmalıyız?",""
"E71E4F8E47E6FAB7FA81BF94A3F35B91","CinematicNode_Response_30","Ja to zrobię.","Ben yaparım.",""
"EEA5C52E45092466A42D56914EA85D20","CinematicNode_Response_31","Panie przewodniczący, teraz należy przeczekać.","Sayın başkan, şimdi beklemekten başka yol yok.",""
"7141A02E4C6B8DE77DF93D9FFD89DD57","CinematicNode_Response_32","Ale nie ma jeszcze pana przewodniczącego.","Ama başkan henüz yok.",""
"EB1034054737365668BFFEB7A946A4DE","CinematicNode_Response_33","Tak, przecież Dickstein nas porzucił.","Evet, Dickstein bizi bırakıp gitti sonuçta.",""
"1A11E89B497C43E4D4F7158348F63BAE","CinematicNode_Response_36","Musiał myśleć o rodzinie. On z nas ryzykował najwięcej.","Ailesini düşünmek zorundaydı. En çok riski o alıyordu aramızda.",""
"BC1087DE471930762F97E08FF7D676AE","CinematicNode_Response_37","To nie ma w tej chwili większego znaczenia.","Şu an bunun bir önemi yok.",""
"173CADBE47A2AADB33EA4AB3C28BD566","CinematicNode_Response_38","Chyba nikt nie był w to tak zaangażowany, jak ty.","Sanırım kimse senin kadar bu işe adanmış değildi.",""
"54384B5140D548C21B91B7A6AAC2738F","CinematicNode_Response_39","Użyję ich najlepiej, jak potrafię. Jeszcze uniwersytet nie zginął.","Elimden geldiğince iyi kullanacağım. Üniversite daha ölmedi.","""Jeszcze Polska nie zginęła"" — Polonya marşına gönderme"
"C89FBC314E0562385CFB579250F34E9F","CinematicNode_Response_4","Nie zgodzę się.","Kabul etmiyorum.",""
"91F553DF417DA9724F712DB449E93723","CinematicNode_Response_4","Trzeba przeczekać, owszem, ale zrezygnować? Nigdy.","Beklemek gerek, doğru, ama vazgeçmek? Asla.",""
"C54D736544C0974D745267AB7AC672B3","CinematicNode_Response_40","Nie, tak nie można.","Hayır, böyle olmaz.",""
"B76095694EDAA0659701C1AAA19DB1FA","CinematicNode_Response_41","Wierzę, że idea Uniwersytetu Latającego przetrwa bez Samuela. Poza tym, zawsze coś może się zmienić.","Uçan Üniversite'nin fikrinin Samuel olmadan da yaşayacağına inanıyorum. Ayrıca her zaman bir şeyler değişebilir.",""
"E6F7A1184EF6A5F07C5C84AE1DC0E028","CinematicNode_Response_42","Powinieneś raczej zapytać Cecylii. Bracie.","Daha çok Cecylia'ya sormalısın. Ağabey.",""
"5638EAA34AD80078B4E4058F9DDF0A77","CinematicNode_Response_6","Gdziekolwiek jest, my nie możemy tu długo zostać. Rosjanie znajdą to miejsce prędzej, czy później.","Nerede olursa olsun, biz burada uzun kalamayız. Ruslar bu yeri er ya da geç bulacak.",""
"CC19E6DE41A44F4CDD0AEBB2D51014B5","CinematicNode_Response_7","Znalazłem u Dicksteina dokumenty, które kompletował, planując zalegalizowanie Uniwersytetu Latającego.","Dickstein'ın evinde, Uçan Üniversite'yi yasal hale getirmek için topladığı belgeleri buldum.",""
"B1932468460E81D20D2136B44A36ED16","CinematicNode_Response_7","Składam je na twoje ręce, panienko Cecylio.","Bunları sizin ellerinize teslim ediyorum, küçükhanım Cecylia.",""
"A1DFA9B64E54C3ED54DF03A44E8CD45F","CinematicNode_Response_8","Pogódźcie się z tym. To koniec Uniwersytetu Latającego. Tak będzie najbezpieczniej dla nas wszystkich.","Bunu kabullenin. Uçan Üniversite'nin sonu. Hepimiz için böylesi en güvenlisi.",""
