"Hash","NodeName","PL","TR","Notes"
"0D13498E45D6176E615BA4A8AC386338","lw_smg04_03a_janitor_with_russians_chats","Wasze rozkazy są ruskie, a moje tutejsze.","Sizin emirleriniz Rus, benimkiler buralı.","kapıcı — Rus askerlere"
"988D8EC94458C788B17558B4BC977109","lw_smg04_03a_janitor_with_russians_chats","I brzmią tak, że ruskich nie puszczamy.","Ve şöyle buyururlar: Rusları içeri almıyoruz.",""
"AC26384A4AD92DF2F065938DC079EB61","lw_smg04_03a_janitor_with_russians_chats","Idź stąd dziadku, póki prosimy po dobroci.","Git buradan ihtiyar, hâlâ iyilikle rica ediyoruz.","Rus asker"
"572A6D7146F6960D658ED6B3CDDFAC9C","lw_smg04_03a_janitor_with_russians_chats","Po moim trupie, się ruszę. Po moim trupie!","Ancak cesedimi çiğneyerek girersiniz. Cesedimi çiğneyerek!",""
"D4EADC49414A39FE7B7DE5A2425010AC","lw_smg04_03a_janitor_with_russians_chats","To akurat da się załatwić.","O iş öyle ya da böyle halledilir.","Rus asker — gizli tehdit"
