"Hash","NodeName","PL","TR","Notes"
"3013DA6B49F4F6E1CB466E90762D3DA3","lw_smc01_sons_girlfriend_chats","Wejdę do środka zaraz za panem.","Arkanızdan hemen içeri gireceğim.",""
"A491A6DE460A55320189FDB0369CB0C6","lw_smc01_sons_girlfriend_chats","Pan mnie wpuści natychmiast!","Beni derhal içeri alın!",""
"E94E373F4ACA2D4667DC66A86C6B1744","lw_smc01_sons_girlfriend_chats","Droga pani, mam zawezwać ochronę?","Sayın hanımefendi, güvenliği çağırayım mı?",""
"5D8A4AF74BBD96C15C8EFF925BFF9E38","lw_smc01_sons_girlfriend_chats","Ty tchórzu! Draniu!","Seni ödlek! Alçak!",""
"70C991FF47065D592933A28C992E260C","lw_smc01_sons_girlfriend_chats","Zostawisz mnie teraz samą? I nasze dziecko?!","Şimdi beni yalnız bırakacak mısın? Hem de çocuğumuzla?!",""
"92866A804B7257801D91DD8C24DEC641","lw_smc01_sons_girlfriend_chats","Odsuń się, człowieku!","Çekil önümden, adam!",""
"FB5575FC404A06F5D581EAA51DB30DC4","lw_smc01_sons_girlfriend_chats","Jak ty w lustro spoglądasz?","Sen aynaya nasıl bakıyorsun?",""
"38F329F3438240B21B828FB4F0FA3F72","lw_smc01_sons_girlfriend_chats","Czego chcesz? Pieniędzy?","Ne istiyorsun? Para mı?",""
"A06B351B4E8A3FCA6990F78EF749869A","lw_smc01_sons_girlfriend_chats","Długo mnie jeszcze będziesz nachodzić?","Daha ne kadar başıma musallat olacaksın?",""
