"Hash","NodeName","PL","TR","Notes"
"9517E4844A5CCFA0E2CD1E8CF772FF69","pp_vset_beggar_m_01","Ja tu jestem królem, prostaku.","Buranın kralı benim, dangalak.",""
"BF9C93DC40F9BCA33EDB37AC61672B61","pp_vset_beggar_m_01","Łazisz po moim błocie.","Çamurumun üstünde geziniyorsun.",""
"8E35C5FB4749053C92D6DB847DC20D2A","pp_vset_beggar_m_01","Gdzie tu łazi? A pozwoliłem?","Buralarda ne dolanıp duruyor? İzin mi verdim?",""
"CF5231DC471093E1D011EB9411E919E1","pp_vset_beggar_m_01","Liczyć sobie zacznę za deptanie mojego terenu.","Toprağıma basmaktan ücret kesmeye başlayacağım.",""
"E8DEFB3B4134631F8877BA93D81621EB","pp_vset_beggar_m_01","To nie jest Imperialny, tu ludzie śpią!","Burası İmperial Oteli değil, burada insanlar uyuyor!",""
"28429DE34FE01B47083284ABBDA7CF2A","pp_vset_beggar_m_01","A patrz się, jakżeś takiego nie widział!","Bak hele, böylesini hiç görmemiş gibi!",""
