"Hash","NodeName","PL","TR","Notes"
"5A2D202C42E965B9804B33A86EC73310","pp_vset_beggar_m_02","Targnę się, do Wisły się rzucę.","Atacağım kendimi, Wisła''ya bırakacağım.",""
"9FF1B89D4CB12AFAA8EE5898C142E7F5","pp_vset_beggar_m_02","Raz mi się noga omskła, to się we wodzie obudziłem.","Bir kere ayağım kayıverdi, suda uyandım.",""
"F5A15C61446029FA96DE91BACF8ECF23","pp_vset_beggar_m_02","Tu wszędzie jest latryna, he he.","Burada her yer tuvalet, he he.",""
"145AD54F44E527BE869EF0AD7A901B6B","pp_vset_beggar_m_02","Cały świat jest moją popielniczką.","Bütün dünya benim küllüğüm.",""
"28DD48304A494E02701BFBA02061130A","pp_vset_beggar_m_02","Pomyleńcy, sami pomyleńcy dookoła.","Kafayı yemişler, etrafımız tepeden tırnağa kafayı yemiş.",""
