"Hash","NodeName","PL","TR","Notes"
"20A5216F42FCFA72025C6FB6AD156055","pp_vset_prostitute_m_01","Marynarze różne gusta mają, a więc oto jestem.","Denizcilerin türlü zevkleri var, işte bu yüzden buradayım.",""
"685E729D4498E61EC679DEABCC7D9121","pp_vset_prostitute_m_01","Nie gap się, to nie przystoi kawalerowi.","Bakma öyle, bey delikanlıya yakışmıyor bu.",""
"7285CE084F932BB517FA40A349C520BA","pp_vset_prostitute_m_01","Masz papierosa? Zapaliłbym przed schadzką.","Sigaran var mı? Buluşmadan önce bir tane içerdim.",""
"6DB852DB40A04E73A12D21A0799C332A","pp_vset_prostitute_m_01","Widzę, że ci ślinka cieknie.","Görüyorum, ağzının suyu akıyor.",""
"4114AA8F47971E8CD28061B7CDFABEA4","pp_vset_prostitute_m_01","Nie wstydź się, nikomu nie powiem.","Utanma, kimseye söylemem.",""
