"Hash","NodeName","PL","TR","Notes"
"862D347E44CC0A2DF1130AAF9622A8B6","pw_vset_beggar_f_03","Pan co się tak wystroiłeś?","Bey, ne diye böyle giyindin?",""
"4069647342CF64B62AA142B97AC2B1A1","pw_vset_beggar_f_03","Barszczyka pan znasz?","Barszczyk''i tanıyor musun beyefendi?",""
"46B8D5C641CA4F797284FBB767BDA37C","pw_vset_beggar_f_03","Przemytniki? Ja nic nie wiem.","Kaçakçılar mı? Ben hiçbir şey bilmiyorum.",""
"10B1512245D497C136B70D83A8917E1E","pw_vset_beggar_f_03","Może i to była broń, ja nie wiem.","Silah da olabilir, bilmem.",""
"4B417067455D691573606B9AD6B171AB","pw_vset_beggar_f_03","Nie wiem, nie znam się, nie orientuję się...","Bilmem, anlamam, tanımam…",""
"3BFBB9054748A00A51997FBB23471C75","pw_vset_beggar_f_03","Mnie to się już wszystko pomieszało we łbie...","Kafamda her şey birbirine girdi gitti…",""
