"Hash","NodeName","PL","TR","Notes"
"4822D4CB49AB16006B150E979CF11AA2","pw_vset_beggar_m_03","Latrynę nam tu postawili, dasz pan wiarę?","Buraya bize tuvalet diktiler, inanır mısın beyefendi?",""
"7115398A4F0240514EF65D9271F190B4","pw_vset_beggar_m_03","Nowa latryna cieszy się zainteresowaniem.","Yeni tuvalet hayli rağbet görüyor.",""
"379594A34E1EFB48A6BCDAA7A5376B01","pw_vset_beggar_m_03","Ludziska całymi dniami sterczą, co by tylko do latryny wejść.","Kalabalık günlerce dikiliyor, sırf tuvalete girmek için.",""
"6EDB81A14F371C53BB2FA78E81D84691","pw_vset_beggar_m_03","Latryna, latrynienka... Wychodek, wychodeczek...","Tuvaletim, tuvaletçiğim… Yüznumaram, yüznumaracığım…",""
"762FC8F44642AE204060AAB5BE7697A0","pw_vset_beggar_m_03","W ciepłym to miło klocka stawiać.","Sıcakta yapmak hoş oluyor doğrusu.",""
"58DF13CE44CF296C407F11946D817631","pw_vset_beggar_m_03","Zara to zasrają i tyle z tego będzie...","Az sonra leş ederler de o iş orada biter…",""
