"Hash","NodeName","PL","TR","Notes"
"491BC2194E08E9C0C205B297B8CEE933","pw_vset_goon_m_05","Jazda stąd, oczytańcu!","Çek arabanı, kitap kurdu!",""
"241142E04B2AEE077C0A809A0A1F7ECC","pw_vset_goon_m_05","Paczajcie go, że czytać niby umie.","Bakın hele, okuma biliyormuş güya.",""
"CF97470F4D80DCA83B986A8E5707E897","pw_vset_goon_m_05","Wyspeswar... wypseswar... wyjebać ci?","Wyspeswar… wypseswar… seni gebertiyim mi?",""
"DA084433426755C290A28FAFEF1C780C","pw_vset_goon_m_05","Te, bibliotekarz. Właśnie by mi się papieru przydało.","Hey, kütüphaneci. Tam da kâğıt lazımdı.",""
"61D91238449A61DAE467EBB515F4C75B","pw_vset_goon_m_05","Profesorek uważa.","Profesör cüceği dikkat ediyor.",""
"BC41FB11464728FF6A5C3EA7B1F02EF3","pw_vset_goon_m_05","Okulary zgubiłeś?","Gözlüğünü mü kaybettin?",""
"6A08FF004BBBD62403046883EB43A3D7","pw_vset_goon_m_05","Sobieski... To był król!","Sobieski… O kraldı!",""
