"Hash","NodeName","PL","TR","Notes"
"65FBAED440A7E709BA04D886C8CC8CF7","pw_vset_ring_commoner_m_02","Pewniak, mówię ci, pewniaczysko.","Garanti diyorum sana, dört dörtlük garanti.",""
"D59D4E72407A40A251C2418CC6E99544","pw_vset_ring_commoner_m_02","Ja cię oszukam? Ja bym cię oszukał?","Ben mi seni dolandırırım? Ben seni hiç dolandırır mıyım?",""
"41634E29411DDE9FE89EC1870303508A","pw_vset_ring_commoner_m_02","A kiedy mówiłem nieprawdę?","Ne zaman yalan söyledim ben?",""
"95AFDF684F876A0A5E9777AC5AF1F22C","pw_vset_ring_commoner_m_02","Ale po co ja bym miał ciebie kłamać?","Sana yalan söylemekten ne kazanırım ki?",""
"1F1340904B6077341AFCB0A7D65F1210","pw_vset_ring_commoner_m_02","Nikomu nie mówiłem, tylko tobie teraz.","Kimseye söylemedim, sadece şimdi sana.",""
