Hash,NodeName,PL,TR,Notes
B5EAF0AA4C5A9934BA58F7B127EF621B,CinematicNode_Response_2,Diabli cię nadali...,Şeytan sürmüş seni buraya…,
0E1B35F7402BA62C482FCDB35AD4DF6F,CinematicNode_Response_2,Można tak powiedzieć.,Öyle de diyebilirsin.,
188104034E931D3B29A8CB8B82D282D3,CinematicNode_Response_3,"Czego tu, przybłędo?!",Ne işin var burada yabancı?!,
13805EA547FD8485BCC53091EA272922,CinematicNode_Response_3,Nie szukam kłopotów. Chciałem tylko porozmawiać.,Bela aramıyorum. Sadece konuşmak istedim.,
A93E8C7D4A6DF6512F51F49436B0A6DE,CinematicNode_Response_3,Już my z tobą pogadamy.,"Biz seninle konuşuruz, göreceksin.",
