"Hash","NodeName","PL","TR","Notes"
"8D58092E46E02CDD01A598906DE112F8","q001_readable_chat","Z jakiegoś powodu świat, zdaje się, nie lubi już Rosji.","Anlaşılan dünya, bir sebepten Rusya'yı artık sevmiyor.","Wiktor iç sesi (gazete yorumu)"
"0BCEE7BF44DC96C01C31A4B64B5C1063","q001_readable_chat","Pewnie rękawiczki.","Muhtemelen eldiven.","(alaycı kısa yorum)"
"D64A400443FAEB7924D83884F38384B2","q001_readable_chat","Ciekawe, czy się zobaczą?","Acaba görüşecekler mi?",""
"782A7B3E4E149C88F48AF393F438D720","q001_readable_chat","Nie udało mu się we francuskiej armii, a w rosyjskiej zaszedł całkiem wysoko.","Fransız ordusunda başaramamış, Rus ordusunda ise epey yükselmiş.",""
"7A9F1F774CB7E7485D7520BB2B8CD904","q001_readable_chat","Rustaweli... Hm, oryginalne tłumaczenie.","Rustaveli… Hm, özgün bir çeviri.","Shota Rustaveli — Gürcü şairi"
"FE22D6D84955F9E30E759A9C36A16CD3","q001_readable_chat","Dobrze się to czyta pod melodię ""Marsylianki"".","""Marsellaise"" ezgisiyle güzel okunuyor.",""
"516A42DB45E2FE54CDE84A84EAF65B20","q001_readable_chat","Bardzo interesujące.","Son derece ilginç.",""
