Hash,NodeName,PL,TR,Notes
C34CA9214FA7B89EE5384ABFC7E38E83,CinematicNode_Choice_1,Zgódź się.,Kabul et.,
18831A394298E7EA5AC9649C8BD84947,CinematicNode_Choice_1,Niech jeszcze poczekają.,Biraz daha beklesinler.,
B52AD83C4A45BB92C5547F805F57DE99,CinematicNode_Response_4,"Panie Wiktorze, ja jestem gotów. Potrzebuję jedynie państwa w komplecie.","Pan Wiktor, ben hazırım. Yalnızca ailenin tamamını bekliyorum.","Pan/Pani = resmi hitap; noter karşılıklı 'siz'"
D841EE16479347EAF31307B6D9ADA191,CinematicNode_Response_4,Czy możemy zacząć odczytanie ostatniej woli pańskiego ojca?,Babanızın son vasiyetini okumaya başlayabilir miyiz?,
1095EFA44E60E705FA04548183EA1309,CinematicNode_Response_5,Tak. Niechaj będzie wola jego. Znowu.,Evet. Onun dediği olsun. Yine.,Wiktor babasına karşı sitem
DA4F204A4C05F54FEDE68982E6B3CAA1,CinematicNode_Response_6,Cierpliwość nigdy nie była mocną stroną mojego ojca.,Sabır babamın güçlü yanı hiç olmamıştır.,
54EA038F4AA478E8E4680EBBC4176AB4,CinematicNode_Response_6,Pan będzie jednak musiał się w nią jeszcze odrobinę uzbroić.,Ama siz de biraz daha sabırlı olmak zorunda kalacaksınız.,
DB672E574AE4476B8235D9BD0FB6508C,CinematicNode_Response_7,"Panie Szulski, jest już dosyć późno. Możemy zacząć?","Pan Szulski, saat iyice geç oldu. Başlayalım mı?","Panie Szulski = Bay Szulski (Wiktor'un soyadı)"
