"Hash","NodeName","PL","TR","Notes"
"C0BFAFF343DF8C3C480BBBB2C47845D2","CinematicNode_Choice_4","Zapytaj, czy to groźba.","Bunun bir tehdit mi olduğunu sor.",""
"AD9324BB413189C45FEA529D29635F7D","CinematicNode_Choice_4","Potraktuj to jak wyzwanie.","Bunu bir meydan okuma olarak karşıla.",""
"B76A87234DB1BE58742C93A82BD9F164","CinematicNode_Choice_5","Zapytaj, czy dobrze zna Swietłanę.","Swietłana'yı iyi tanıyıp tanımadığını sor.",""
"34E95C274D6F46E1C379CC8A138E9253","CinematicNode_Choice_5","Wspomnij, że widziałeś jej plakat.","Afişini gördüğünü söyle.",""
"A6F858F346E0A9BAAFEB98A3396C91B5","CinematicNode_Choice_5","Dowiedz się, kogo będzie przywoływać.","Kimi çağıracağını öğren.",""
"FF96D2B04AEBD4B18615458F6C9F06EC","CinematicNode_Choice_5","Zapytaj, czy łatwo nabrać ludzi na seans.","İnsanları seansa kandırmanın kolay olup olmadığını sor.",""
"CC75F4274EDB3B2142D5DB8DD83A508B","CinematicNode_Choice_5","Odejdź.","Uzaklaş.",""
"47D3F83C4F3340314E689FA7A7A139AF","CinematicNode_Choice_6","Przejdź do tematu dzikiego salutora.","Vahşi salutor konusuna geç.",""
"C29D63E84D4A6F97E550569B257A667E","CinematicNode_Choice_6","Najpierw zwróć uwagę na jej salutora.","Önce onun salutoruna dikkat çek.",""
"1F06D7DE4AD2467EA7D513A84B67F8C6","CinematicNode_Choice_6","Skomentuj jej podwójną tożsamość.","Çift kimliği üzerine yorum yap.",""
"ADE4A39040BBF87DA53955B3E6604ED2","CinematicNode_Choice_7","Kończ tę dyskusję.","Bu tartışmayı sonlandır.",""
"9961577E4AD1035D1E23ACB23ACAAA87","CinematicNode_Choice_7","Powiedz, że zrobisz, jak uważasz.","Bildiğin gibi yapacağını söyle.",""
"1BCC795B4E3366848CE628B6DAFD7F88","CinematicNode_Choice_7","Dowiedz się, ile ona wie.","Onun neler bildiğini öğren.",""
"43F0A443434BAD6C3ACD119DA4862C98","CinematicNode_Choice_7","Dopytaj o osobę ze Skazą.","Kusur taşıyan kişi hakkında sorgula.",""
"D62179624909DB32702801A9EE274E32","CinematicNode_Response_26","Łatwo nabierać ludzi na te bzdury o duchach?","İnsanları bu ruh saçmalıklarıyla kandırmak kolay mı?",""
"A2C846CB4D5D4AC4FFE6C9A4263705D8","CinematicNode_Response_26","Każdy sposób jest dobry, jeśli dzięki temu kolejny <i>przybysz</> dołączy do kolekcji, czyż nie?","Sayesinde koleksiyona bir <i>konuk</> daha eklenecekse her yol mübah, öyle değil mi?",""
"5B72C30A4FD67FB7D67DD58758B2660A","CinematicNode_Response_26","Dużo ich masz? Pewnie już więcej ich tam nie zmieścisz.","Çok mu var? Muhtemelen artık fazlası sığmıyordur.",""
"AD3EC4DE49B7001CEAE6759B2E0A9302","CinematicNode_Response_26","Zawsze się znajdzie miejsce na jednego więcej. ","Bir tane daha için her zaman yer bulunur. ",""
"F553AB544372C69499C7358A72C4DFC3","CinematicNode_Response_26","Twoja Skaza to Chciwość?","Senin Kusur'un Açgözlülük mü?","'Chciwość' ≠ glossary 12 Kusur; muhtemelen örtük espri — kelime anlamıyla"
"12E6A57D4A750DD4BF984F9795B5EBCD","CinematicNode_Response_27","Mało subtelna to groźba.","Pek ince olmayan bir tehdit.",""
"E908970744ABD4C271BA04B64C8DD084","CinematicNode_Response_27","Bywam mało subtelna, gdy mi na czymś zależy.","Bir şeye önem verdiğimde ince olmayabiliyorum.",""
"7D7CBFEA4DA4B5A4E7FE6D81C4A12AD2","CinematicNode_Response_27","Szanuję to.","Saygı duyuyorum.",""
"6B38A4DB420BD926C3E528BFC7AEF249","CinematicNode_Response_28","Chyba podejmę tę rękawicę. ","Bu eldiveni kaldıracağım galiba. ",""
"7E017B5845BBDF672694DAA6A04611C2","CinematicNode_Response_29","Widziałem jeden z twoich plakatów. Wyglądasz na nim... inaczej.","Afişlerinden birini gördüm. Üzerinde… farklı görünüyorsun.",""
"E404FDB74DFA9B2F53A1F79A7679324D","CinematicNode_Response_29","Naprawdę? Rysunek nie oddaje rzeczywistości?","Sahi mi? Çizim gerçeği yansıtmıyor mu?",""
"184933804774F4C9145C13B2E6D208F5","CinematicNode_Response_29","Jak to ująć? Nikt mnie nie uprzedził, że powinienem był się przebrać na przyjęcie.","Nasıl söylesem? Kimse davete uygun giyinmem gerektiği konusunda beni uyarmadı.",""
"EA736635442DF1022BF9C69444D2F56C","CinematicNode_Response_29","Słucham?","Efendim?",""
"A3F57A06445853D30EE69AAD2D95913E","CinematicNode_Response_29","Zwracam tylko uwagę na to, jak wyjątkowo wyglądasz na tle nudnych gości.","Sıkıcı konukların arasında ne kadar sıra dışı göründüğüne dikkat çekiyorum sadece.",""
"E9E1D4414AD9381A0C92D89B11307E26","CinematicNode_Response_29","Bezczelny.","Küstah.",""
"A4A2A588430838A1369A8CAE9C2E3851","CinematicNode_Response_29","Tylko trochę nieokrzesany, jeśli już.","Biraz yontulmamış, hadi bilemedin.",""
"8E64F1FD4668A2CA07B436AA52ADFB56","CinematicNode_Response_30","Dobry wieczór.","İyi akşamlar.",""
"EE8E35804475F6962030D382CBA7B52C","CinematicNode_Response_30","Ćśś... Energia nie może zostać zaburzona.","Şşt… Enerji bozulmamalı.",""
"2C54630B49F36CCFC9E8E9835857555F","CinematicNode_Response_31","I posłuchaj mnie uważnie, panie Jakcitam.","Ve beni dikkatle dinleyin, Pan Her Neyse.",""
"BDA9A3E04F947A77C6F3ECAF9DAFEF30","CinematicNode_Response_31","Szulski, ale wystarczy Wiktor.","Szulski, ama Wiktor yeter.",""
"21462FF64C82A4989C1A68A73B795B46","CinematicNode_Response_31","Rozpłyniesz się teraz, jak zły sen, panie Szulski, a ja wrócę do pracy.","Şimdi kötü bir rüya gibi dağılacaksınız, Pan Szulski, ve ben işime döneceğim.",""
"1C9E27C0419726AD9107A5AB2E4188C8","CinematicNode_Response_32","I znów aura legła w gruzach.","Yine aura enkaz oldu.",""
"2BE7D2C34EB05FD8CBE544AC570026C6","CinematicNode_Response_33","Nie będę już zaburzał energii. Dopóki nie wrócę.","Artık enerjiyi bozmayacağım. Dönene kadar.",""
"A80BB8AF408F5D93EB1B03ABE67EB655","CinematicNode_Response_33","...","…",""
"6CD079714A35CD8745A4949ACF54DEB1","CinematicNode_Response_34","Szulski, nie pogrywaj sobie ze mną.","Szulski, benimle oyun oynama.",""
"9E23B4664E1BEC33A32D078449FF2F63","CinematicNode_Response_35","Dobrze znasz gospodynię?","Ev sahibesini iyi tanıyor musun?",""
"5CAF120C4756DFD758E222868F6B4089","CinematicNode_Response_35","A dasz mi spokój, jeśli powiem, że nie?","Hayır dersem, beni rahat bırakır mısın?",""
"89422D044C900AFD1E0218A298A989D5","CinematicNode_Response_35","Nie.","Hayır.",""
"0F2488634D984565BC3589BCD31CBC36","CinematicNode_Response_35","Pani Rumiancewa zaprasza, a ja staram się sprostać oczekiwaniom.","Bayan Rumiancewa davet ediyor, ben de beklentileri karşılamaya çalışıyorum.",""
"051FC4B64659B9DB3422DBBE7F809F8F","CinematicNode_Response_35","Nie wchodźmy sobie w drogę.","Birbirimizin yoluna girmeyelim.",""
"FFE6F62745700418266524AE0132FE04","CinematicNode_Response_36","Czyją duszę przywoła dzisiaj droga <fr>madame</>?","Saygıdeğer <fr>madame</> bugün kimin ruhunu çağıracak?",""
"AE8B2D434D31FA54BF4FF0A6724533CD","CinematicNode_Response_36","Wiem tylko, którą wolałabym odprawić. Sio.","Hangisini uzaklaştırmayı tercih edeceğimi biliyorum. Kış.",""
"D369B0FD48F76896493D6790AFA87DF3","CinematicNode_Response_36","Może mojego zmarłego ojca? Gdyby się udało, zaoszczędziłoby mi to sporo trudu.","Belki merhum babamı? Başarılsa bana bir hayli zahmetten kurtarırdı.",""
"432023A2415522657D10299B952E67EE","CinematicNode_Response_36","Teraz nigdy się nie dowiemy.","Şimdi asla öğrenemeyeceğiz.",""
"E3E0A67945DABA0E4727EC97175BCE82","CinematicNode_Response_37","Znikam. Na teraz.","Kayboluyorum. Şimdilik.",""
"6B3640A84E9CF6BEAD7E448B3C2CC2D2","CinematicNode_Response_38","Nie wracaj zbyt prędko.","Çabuk dönme.",""
"D9805037438510FE80B7E1818D51F557","CinematicNode_Response_39","Czasem dobrze jest odpuścić i pozwolić innym robić swoje.","Bazen vazgeçip başkalarının kendi işini yapmasına izin vermek iyidir.",""
"771386BD49672AC3AFF9D7BD87FF0EC2","CinematicNode_Response_39","Dla własnego dobra.","Kendi iyiliğin için.",""
"19A916F447D8AF4D84E4F5B72F1F3D55","CinematicNode_Response_40","Może już starczy. Czego chcesz?","Bu kadarı yeter. Ne istiyorsun?",""
"0F7214F44CB0F3D93601728365EECE7C","CinematicNode_Response_40","Sztuczka z wchodzeniem do głowy. Znam jednego, co też tak umie...","İnsanın kafasına girme numarası. Aynı şeyi yapan birini daha tanıyorum…",""
"E943DF96471E25903F65F49C25BBE59F","CinematicNode_Response_40","Marny z ciebie thaumaturg, jeśli ty nie potrafisz.","Yapamıyorsan zavallı bir tılsımkârsın.",""
"7F59D2B24BFF2F0F54318CB27882ECEA","CinematicNode_Response_40","Przyszedłeś mnie dręczyć? Zdemaskować?","Bana eziyet etmeye mi geldin? Maskemi düşürmeye mi?",""
"1211D9C84D0CAF615A29819BFAB63402","CinematicNode_Response_40","W tym drugim nie widzę frajdy.","İkincide bir keyif göremiyorum.",""
"297C89804240D7E00D7DD39D44AAEE3A","CinematicNode_Response_40","Więc czego chcesz?","O halde ne istiyorsun?",""
"A4D4C560459950E9163999B61320EC31","CinematicNode_Response_41","Zauważyłem tu dzikiego salutora. Rozumiem, że twoja obecność jest związana właśnie z nim.","Burada vahşi bir salutor fark ettim. Varlığının onunla ilgili olduğunu anlıyorum.",""
"F718A6744F58FB1EC0E2A2B6B7A08D64","CinematicNode_Response_41","Nie mieszaj się w to.","Bu işe karışma.",""
"4045FD644B8BB5A32EB328AACE68E39C","CinematicNode_Response_41","Dlaczego?","Neden?",""
"AD2004244D0DCC7EDFC057870304ACB6","CinematicNode_Response_41","Bo cię ostrzegam.","Çünkü seni uyarıyorum.",""
"B380BA584AE9D8919F211380E9F65915","CinematicNode_Response_42","Twój Sirin jest naprawdę imponujący.","Senin Sirin'in gerçekten etkileyici.","Sirin = Samira'nın salutoru"
"676807364589787F39EEEE81D3EF19B5","CinematicNode_Response_42","Pochlebstwa nigdzie cię nie zaprowadzą.","Yağcılık seni hiçbir yere götürmez.",""
"3CFA080C43EDA537A67EECAEADB6DC01","CinematicNode_Response_42","Madame, jesteś nieuprzejma. Może zrobimy małe zawody? Zobaczymy, kto wygra.","Madame, kabasınız. Küçük bir yarış yapalım mı? Kimin kazanacağını görelim.",""
"77BC98BE4DCEA5ECA94B4FB10407CF31","CinematicNode_Response_42","Spasuję.","Pas geçerim.",""
"FD67F18543030E3326100184B95D4882","CinematicNode_Response_43","Uważam, że pomysł z udawaniem medium jest świetny.","Medyum rolü yapma fikrinin harika olduğunu düşünüyorum.",""
"B577DC8A45B80A104F38A991019D7F50","CinematicNode_Response_43","Brzmisz, jakbym ci zaimponowała.","Seni etkilemişim gibi konuşuyorsun.",""
"21BAB4EB4AC1F9E9BFA4F2A040682464","CinematicNode_Response_43","Jak wiele osób wie?","Kaç kişi biliyor?",""
"77D4206E47814E7216E7BC9DCA22568C","CinematicNode_Response_43","To groźba?","Bu bir tehdit mi?",""
"C7443539411770ACB2BD90B835F1E3E5","CinematicNode_Response_44","Co wiesz o tym salutorze? Wiesz, jak się nazywa?","Bu salutor hakkında ne biliyorsun? Adını biliyor musun?",""
"1C3E1D7446147DD60F52339050B6021F","CinematicNode_Response_44","A ty nie?","Sen bilmiyor musun?",""
"FEDD5EB34BC66E794DE78CBA5C7D19C0","CinematicNode_Response_45","Imię i tak niewiele daje, liczy się tylko wyłuskanie z tłumu osoby ze Skazą.","İsim zaten fazla bir şey vermez; önemli olan Kusur taşıyan kişiyi kalabalıktan ayırmak.",""
"A352D0B44F2F7C71D5B00DA6DB8EBBDB","CinematicNode_Response_45","Ja doskonale wiem, kto nosi Skazę.","Kusur'u kimin taşıdığını çok iyi biliyorum.",""
"BCE75DCC48AFAEAA763533856885FC1C","CinematicNode_Response_46","Weles. Tylko cię sprawdzałem.","Weles. Yalnız seni sınıyordum.",""
"4F8CC847482FCB28CB2AFAAE87F87ACD","CinematicNode_Response_47","Osoba ze Skazą weźmie udział w seansie, tak?","Kusur taşıyan kişi seansa katılacak, değil mi?",""
"BF36B0944558D2F655D14A8318AFF988","CinematicNode_Response_47","...","…",""
"3AEA1CED49A8C874A9568D8B74A9ED2C","CinematicNode_Response_47","Czyli trafiłem.","Demek tutturdum.",""
"0106BFBB4198EACD82D151AA918648F4","CinematicNode_Response_47","Skończyłeś?","Bitirdin mi?",""
"5A0ADCAF46ACA316FE4F9AAB290A763D","CinematicNode_Response_48","Taki ton nie przystoi damie, Madame.","Bu ton bir hanıma yakışmaz, Madame.",""
"C1990B844F9A1789C5AE1DBFF2EF0FA0","CinematicNode_Response_48","Może niech tego salutora złapie po prostu lepszy?","Bu salutoru sadece daha iyi olan yakalasın?",""
"B59A160D41EBA8454F6D988392E5413B","CinematicNode_Response_48","Mówisz o sobie?","Kendinden mi söz ediyorsun?",""
"4195C27744B8C99593C353BEEC162FEA","CinematicNode_Response_49","Kończymy zatem?","O halde bitiriyor muyuz?",""
"69C5F6354E4E1F3BC0238BBBA3F11C47","CinematicNode_Response_49","Tak będzie najlepiej.","En iyisi öyle olacak.",""
"66965D7E47F97704DAB0348A8E5C6234","CinematicNode_Response_50","Kolejny powód, abyś się w to nie mieszał.","Bu işe karışmaman için bir sebep daha.",""
"DE778FB542109F6C4B5E0AB19339AFDA","CinematicNode_Response_51","To jest nas dwoje.","Yani ikimiz biliyoruz.",""
