Hash,NodeName,PL,TR,Notes
052512D444D95D8758720988A23DB0FE,q104_09e_police_carriage_chat,"Jak będziesz się stawiał, to skończysz w celi.","Diklenirsen, sonun hücrede olur.",
54FE9DCF4CABE2B3690AD4B897C0FE11,q104_09e_police_carriage_chat,Nie możecie niszczyć naszych towarów.,Mallarımızı imha edemezsiniz.,
807DD20D4015AAD4E4CAFF801B43922B,q104_09e_police_carriage_chat,"Póki broń się nie znajdzie, możemy wszystko.","Silah bulunana dek, her şeyi yapabiliriz.",
CDAE01C64A98B433D356DD9421901FC2,q104_09e_police_carriage_chat,Mamy swoje prawa!,Bizim de haklarımız var!,
336E3F064344440138353D8DB3A505E7,q104_09e_police_carriage_chat,My mamy prawo użyć pałek. Mam z niego skorzystać?,Bizim de cop kullanma hakkımız var. Yararlanayım mı?,
31F4D077465F42349135E78B002F2CD3,q104_09e_police_carriage_chat,Nie...,Yok…,
