Hash,NodeName,PL,TR,Notes
03998A3E4D1CFA5ED502B9BF86418622,CinematicNode_Choice_10,"Oczywiście, że dasz radę.",Elbette başarırsın.,
9E69A54946C4C821CF6EB8BB9A013981,CinematicNode_Choice_10,"Dowiedz się, o który sekret mu chodzi.",Hangi sırdan söz ettiğini öğren.,
7927192847F68B7BE10FB68272BBC308,CinematicNode_Choice_10,"Zapytaj, co będzie, jeśli odmówisz.",Reddedersen ne olacağını sor.,
6CC0FBD946FF1BC961956592A94E07B7,CinematicNode_Choice_10,1,1,
3518435B43E334D6C6E803ABF0761E9A,CinematicNode_Choice_10,2,2,
40F57B0C414C7062DE9874AF39B415E9,CinematicNode_Choice_10,3,3,
5824B3D74A971826D5D4E2A9E233CBD5,CinematicNode_Choice_11,Pożegnaj się.,Vedalaş.,
56E1FCAB46BCE9DFB3BCD59C07AABF56,CinematicNode_Choice_11,Niech już przejdzie do sedna.,Sadede gelmesini iste.,
7AEF22E44662C821160EA284145FF3A2,CinematicNode_Choice_11,1,1,
6013E6AC42D04637C915F9B4A0E9BC2B,CinematicNode_Choice_11,2,2,
28F9C1FD40D82C927986AD8F924022A1,CinematicNode_Choice_6,"Zapytaj, co on tu robi.",Burada ne yaptığını sor.,
F67D0B3F4DB70F251A7271BA4723A7A9,CinematicNode_Choice_6,"Powiedz, że miałeś ciężką noc.",Zor bir gece geçirdiğini söyle.,
CC10CAB242FDCF497EC124B215B945BE,CinematicNode_Choice_6,"Zapytaj, skąd wiedział, gdzie mieszkasz.",Nerede oturduğunu nereden bildiğini sor.,
570A224F472E1521620EED9483B092F9,CinematicNode_Choice_6,1,1,
268D66204AE652A875285C817B55AD6F,CinematicNode_Choice_6,2,2,
59A5127A40CB78249184A6A55AE863FD,CinematicNode_Choice_6,3,3,
765596584940556DC992E78E1E430B84,CinematicNode_Choice_7,"Powiedz, że Swietłana nie żyje.",Swietłana'nın öldüğünü söyle.,
DA346D98455042B6ED1CE29A1A7A4F1C,CinematicNode_Choice_7,Najpierw powiedz mu o Golemie.,Önce ona Golem'den bahset.,
DA71100D495F3E9339E3E186773B3412,CinematicNode_Choice_7,1,1,
EBC3C3FF48B95C1B085A88B57FC76978,CinematicNode_Choice_7,2,2,
33A839A24B41E551051BD48E940BB8BB,CinematicNode_Choice_8,Powiedz o Golemie.,Golem'den bahset.,
A059DE5F4CF47376572457B711987D90,CinematicNode_Choice_8,"Burknij, że nie chcesz o tym mówić.",Bu konuda konuşmak istemediğini homurdan.,
2532F90946253651F9957895EB3A4C2A,CinematicNode_Choice_8,1,1,
1E4E28DD4698EFFDCA6788BE8938BE3D,CinematicNode_Choice_8,2,2,
32A73AF94C5E4B8542792DA34EAB4D1D,CinematicNode_Choice_9,"Powiedz, że chcesz wiedzieć.",Bilmek istediğini söyle.,
FF893B2949427E40F3A89D95CF975E06,CinematicNode_Choice_9,"Dopytaj najpierw, czy chodzi o szantaż.",Önce mesele şantaj mı diye sor.,
AAE9AC30432960F9A9345B888FFA7A6E,CinematicNode_Choice_9,Zaprzecz. Nie interesuje cię to.,Reddet. Seni ilgilendirmiyor.,
E72E19584333C8C37AA9A3988FA9DD9A,CinematicNode_Choice_9,1,1,
3170022C41D3157DAA87058EC3676A5D,CinematicNode_Choice_9,2,2,
7F7D109B4718C87A978FB3B8A00D44E6,CinematicNode_Choice_9,3,3,
4ECB61934F016ECC7DD1469D8291B4F4,CinematicNode_Response_27,Wyglądasz na zmęczonego. Wszystko w porządku?,Yorgun görünüyorsun. Her şey yolunda mı?,Rasputin
C9169DA14C6CDFDB75DA9D981589B445,CinematicNode_Response_27,Potrzebujesz mojej pomocy?,Yardımıma ihtiyacın var mı?,
202FE0914E4C841BF2DEE5B6B6128C0E,CinematicNode_Response_28,To była dla mnie wyjątkowo ciężka noc.,Benim için son derece zor bir geceydi.,Wiktor
2AE8D7A64CDD28C9845E438559BBCB20,CinematicNode_Response_28,Czy ze Swietłaną wszystko w porządku?,Swietłana ile her şey yolunda mı?,
1727DF4949351025B80F48AFC6268A1F,CinematicNode_Response_28,Czemu pytasz?,Neden soruyorsun?,
8474552D47730ADC0843DA823111AE1A,CinematicNode_Response_28,Wyszliście bez pożegnania. Coś się stało?,Vedalaşmadan çıktınız. Bir şey mi oldu?,
D2FA0B0B40CE410F3E4090A180C34677,CinematicNode_Response_29,Golema? Z żydowskich legend? Jest salutorem?,Golem mi? Yahudi efsanelerinden olan mı? Bir salutor mu?,
3854FDE549665F98464D6B96AD8A65B0,CinematicNode_Response_29,Tak - i okazał się bardzo prawdziwym salutorem. Materialnym.,Evet — ve son derece gerçek bir salutor olduğu ortaya çıktı. Maddi bir salutor.,
626AA6B940E219422E8963A241E91B16,CinematicNode_Response_29," Nie sądziłem nawet, że to jest możliwe...","Bunun mümkün olabileceğini tahmin bile etmezdim…",
C7E7FA6545AD454A10DE13ADC289768F,CinematicNode_Response_29,I jaki to ma związek ze Swietłaną?,Bunun Swietłana ile ne alakası var?,
E8F4C2B346DE28D50B40079A263AF498,CinematicNode_Response_30,Swietłana niestety nie żyje.,Ne yazık ki Swietłana öldü.,
AF727ECA42BE133AD53429B868A9D6DC,CinematicNode_Response_30,...,…,
E574335A4C63FCEC3CE9569BD8303A5E,CinematicNode_Response_30,Tego się obawiałem.,Bundan çekiniyordum.,
4589A04E48E49F46089DF0886E7C2EE4,CinematicNode_Response_31,Jak to się stało?,Nasıl oldu?,
E59E97204E1F98D2BE93C38B14A03304,CinematicNode_Response_32,Golem ją zabił?,Onu Golem mi öldürdü?,
BAF03FD44CD3EBE055560EB343CC3FA0,CinematicNode_Response_32,"Można tak powiedzieć. Golem zatopił łódź, ciskając w nią kufrem z jej tajną korespondencją.","Öyle de denebilir. Golem, onun gizli yazışmalarını içeren sandığı tekneye fırlatıp batırdı.",
3749204B47C7E1087657498EC606C772,CinematicNode_Response_32,Swietłana zamierzała żyć ze sprzedaży cudzych sekretów.,Swietłana başkalarının sırlarını satarak geçimini sağlamayı planlıyordu.,
4B2D437F431B65EF7FA0B4AF04926288,CinematicNode_Response_33,To nie jest dobra chwila na tę rozmowę.,Bu konuşma için iyi bir an değil.,
263629FE44C8E72C4632F5B1B21F82BE,CinematicNode_Response_33,"Rozumiem, ale Swietłana... Poznałem ją i wiem, że dźwigała na sobie duży ciężar.","Anlıyorum, ama Swietłana… Onu tanıdım ve üzerinde büyük bir yük taşıdığını biliyorum.",
E30B18DA47B329C9971845B9CD681DC7,CinematicNode_Response_34,Nie spodziewałem się wizyty domowej.,Eve ziyarete geleceğini beklemiyordum.,
E0796F4246753AD036BCB284B2F0E8BB,CinematicNode_Response_34,"Chciałem się dowiedzieć, czy Swietłanie udało się bezpiecznie wyjechać.",Swietłana'nın sağ salim gidebilip gidemediğini öğrenmek istedim.,
05E4AE344585FC8CC6D60396B771699E,CinematicNode_Response_35,Skąd znasz mój adres?,Adresimi nereden biliyorsun?,
0988E2F84EC057E6F732FEAC71E361C2,CinematicNode_Response_35,"Ludzie w Warszawie wiedzą, kim są Szulscy.",Varşova'daki insanlar Szulski'lerin kim olduğunu bilir.,
6BE3C4294F678E82955536B6853B4A1D,CinematicNode_Response_35,Jesteś przygaszony. Czy coś się stało?,Suskunsun. Bir şey mi oldu?,
EF05C96B4E794EDC1730EC95980C3E89,CinematicNode_Response_36,Wreszcie jesteś. Czekaliśmy na ciebie.,Nihayet geldin. Seni bekliyorduk.,
6E4D31F94E0FCAF7EFBC04885C493663,CinematicNode_Response_36,"Obawiam się, że zanudziłem twoją uroczą siostrę moim gadaniem.",Korkarım şirin kız kardeşini gevezelikle sıktım.,
1177256448A672A813EE339FC2A227EB,CinematicNode_Response_36,Ależ skąd. Zostawię was samych.,Hiç de değil. Sizi yalnız bırakayım.,Ligia
FA21AE73408CA7AFB25430B223F8604E,CinematicNode_Response_37,Sekrety potrafią być zabójcze.,Sırlar ölümcül olabilir.,
4FFEEB364431A5582F2D508E5D63AC6E,CinematicNode_Response_37,"Chcesz wiedzieć, czym się ze mną podzieliła?",Benimle neyi paylaştığını öğrenmek ister misin?,
213F4FDC443F6669590A1F9EC22DF954,CinematicNode_Response_38,Chyba mam wystarczająco własnych tajemnic do rozwikłania.,Sanırım çözmem gereken yeterince kendi sırrım var.,
310E54EF474804AA08230DB00B4BCC25,CinematicNode_Response_38,"Nie wiem, co ukrywasz, ani czego nie potrafisz odkryć, ale... Swietłana miała rację.","Neyi sakladığını ya da neyi ortaya çıkaramadığını bilmiyorum, ama… Swietłana haklıydı.",
AA84CAFD4B8A8EF3C892E8A223EBEF14,CinematicNode_Response_38,Ta konkretna wiedza jest bezcenna. Rozwiązuje języki i otwiera drzwi. ,Bu belirli bilgi paha biçilmezdir. Dilleri çözer ve kapıları açar.,
2F4D3C7144C978246FF293A9C15519C8,CinematicNode_Response_38,Ciekawy?,İlgili misin?,
BD266EAB472FE415B03CF4AA988BDD69,CinematicNode_Response_39,Jestem zaintrygowany.,Merak ettim.,
BC0D4ADC496F44A75C3D9AAC70045094,CinematicNode_Response_39,"Pytanie, czy dasz radę udźwignąć brzemię, jakie i ona nosiła?",Onun taşıdığı yükü kaldırabilir misin — soru bu.,
8D70383A47F72B47B3B627927D9A22C7,CinematicNode_Response_40,Chyba nie chcesz nikogo niczym szantażować?,Umarım kimseye şantaj yapmayı düşünmüyorsundur?,
C402FACC4508204252EC45A15ED749FE,CinematicNode_Response_40,Skąd! Oczywiście że nie.,Aman! Elbette hayır.,
8713B7BA4F3986584E522881D2593544,CinematicNode_Response_40,"Mówiłem ci, chcę, aby świat ujrzał moją prawdę. Chcę powstrzymać zagładę wielu ludzkich istnień. Ale w pojedynkę jestem jak Kasandra...","Sana söylemiştim, dünyanın benim hakikatimi görmesini istiyorum. Pek çok insanın yıkımını önlemek istiyorum. Ama tek başıma Kassandra gibiyim…",
5B1EAE6B442CBFFD958F1D888965B591,CinematicNode_Response_40,"Ale mając wiedzę Swietłany i ciebie przy moim boku, nie będzie nikogo, kto by mi nie uwierzył.","Ama Swietłana'nın bilgisi ve sen yanımdayken, bana inanmayacak kimse olmayacak.",
433DCFA3414412A4238412B971CE95DC,CinematicNode_Response_41,"Myślę, że dźwignę i to, jeżeli dzięki temu pozbędę się tamtych problemów.","Eğer bu sayede öteki sorunlardan kurtulursam, onu da kaldırabilirim diye düşünüyorum.",
7A26F2C649968E7BB48D11A675617E99,CinematicNode_Response_41,...,…,
85C40FB94C76CB97899B5584CBE2B383,CinematicNode_Response_42,"Możesz powiedzieć, który sekret Swietłany masz na myśli? Miała ich pełen kufer.",Swietłana'nın hangi sırrından bahsettiğini söyleyebilir misin? Bir sandık dolusuydu.,
0F9BE8B54A00C696572A01BF23C5B446,CinematicNode_Response_43,"Czy kiedykolwiek odmówiłem ci pomocy? Przeciwnie, to ty obiecałeś mi swoją. Wtedy, z Bukavacem.","Sana hiç yardım etmeyi reddettim mi? Aksine, sen bana yardımını vaat etmiştin. O zamanlar, Bukavac'la.",
AA2A11864F7DF9700E2B2694E9304281,CinematicNode_Response_43,To prawda. Skoro tak stawiasz sprawę...,Doğru. Meseleyi böyle koyuyorsan…,
1BF0CF64468CCA13E22C1E82734309E2,CinematicNode_Response_44,Tego nie było w kufrze. A teraz jest tylko w mojej pamięci.,O sandıkta değildi. Artık yalnızca hafızamda.,
011621344BD1A1A25FB222B80F1E73C0,CinematicNode_Response_44,"Powiesz mi, o co chodzi?",Meselenin ne olduğunu söyler misin?,
C6CA7BA54CFE63EA9735D2826C7EC565,CinematicNode_Response_44,"Nie, tutaj nie. Najpierw odpocznij.","Hayır, burada değil. Önce dinlen.",
3A9E14D9489026E64D1D4DAC395CD084,CinematicNode_Response_44,"Przy następnym spotkaniu, u Nadarzyńskich. Tam na razie jest bezpiecznie.","Bir sonraki buluşmada, Nadarzyńskilerde. Orası şimdilik güvende.",
CD1E49E543AF5C46728B9285B5587E0F,CinematicNode_Response_45,"Ale muszę ci powiedzieć, że kufer ze wszystkimi listami Swietłany spoczywa razem z nią na dnie Wisły.","Lakin sana söylemem lazım, Swietłana'nın tüm mektuplarını taşıyan sandık onunla birlikte Wisła'nın dibinde yatıyor.",
AE982C894303587E8005B382EA54D14C,CinematicNode_Response_46,"Ale cały jej dobytek i tajemnice były w kufrze, a ten, zaręczam, przepadł razem z nią na zawsze.","Ancak tüm eşyaları ve sırları sandıktaydı ve onu temin ederim, sandık onunla birlikte ebediyen kayboldu.",
53A6084B4D4DDE5F0071EA9E75A8E238,CinematicNode_Response_47,Jeszcze jedno. Czy ten Golem może ściągnąć na ciebie jakieś kłopoty?,Bir şey daha. Şu Golem sana bir bela getirebilir mi?,
C12267BF4A5351B288578F8F0BD95B5A,CinematicNode_Response_47,Pewnie wkrótce się dowiem.,Muhtemelen yakında öğreneceğim.,
1C8BAF9544C6F9E8E5B01CAB6229DB36,CinematicNode_Response_48,"Jaki znowu Golem? Zresztą nie, nie mów mi. Nie chcę wiedzieć.","Ne Golem'i ya? Zaten hayır, bana söyleme. Bilmek istemiyorum.",
027E1B3F45A38F79732066A45E1F157C,CinematicNode_Response_49,Dziękuję za wizytę.,Ziyaret için teşekkürler.,
6C4F5DFD444207C2B29B5682D07ECE3B,CinematicNode_Response_49,"Do zobaczenia wkrótce, mój drogi.","Yakında görüşürüz, sevgili dostum.",
DAB8CF03442D1B05A22B93B3AED0A25A,CinematicNode_Response_50,Dobranoc. Śnij bezpiecznie.,İyi geceler. Güvende rüyalar gör.,
61F4807F42D8F69F37A995823CC13FC8,CinematicNode_Response_51,Wtajemniczysz mnie kiedyś?,Beni bir gün sırrına ortak eder misin?,
45AAA6CD4766F69BBCD1E293E0B03E27,CinematicNode_Response_51,"Nie chcę na razie ryzykować. Nie chcę nawet o tym tutaj mówić, żeby twoja siostra nie miała z tym nic wspólnego.","Şimdilik risk almak istemiyorum. Hatta bunu burada konuşmak bile istemiyorum, kız kardeşin bu işe karışmasın diye.",
