Hash,NodeName,PL,TR,Notes
BB39EADB4E16F7D191FFC2AF9CF5A142,q104_01d_ariel_and_javier_chat,"Potrzebujemy dokumentów, łajby i kapitana.","Belgeler, tekne ve bir kaptan lazım.",
6BFD8F8B4CC673EAA4B3F4B503981733,q104_01d_ariel_and_javier_chat,Ludziom w porcie też trzeba posmarować.,Limandaki adamların da avucunu yağlamak lazım.,
30DA88E348C418E3DAF063A52FF4C455,q104_01d_ariel_and_javier_chat,"Żeby wiedzieli, kiedy przestać się gapić.",Ne zaman bakmayı bırakacaklarını bilsinler diye.,
34D90D9D463483A08A2365AF4CDECF87,q104_01d_ariel_and_javier_chat,Racja. Kosztowne przedsięwzięcie.,Haklısın. Masraflı bir iş.,
1A4FC77548ADB7C060A6F68A5D71AE24,q104_01d_ariel_and_javier_chat,"Opłaci się, amigo! Będziemy bogaci!","Kârlı çıkar, amigo! Zengin olacağız!",Javier'in amigo hitabı korundu
