"Hash","NodeName","PL","TR","Notes"
"B48F2BE747BDE77D422077AFF605D5C0","q201b_04d_ligia_with_customer_chat","Bardzo dziękuję, panienko Ligio.","Çok teşekkürler Bayan Ligia.",""
"171212394D10D2F5F21C80B2D5DA3230","q201b_04d_ligia_with_customer_chat","Cieszę się, że mogłam pomóc.","Yardım edebildiğim için memnunum.",""
"9A3B76FC4313497247A786A3FCA926A6","q201b_04d_ligia_with_customer_chat","Gdyby każdy tak prowadził interesy jak pani.","Bir Hanımefendi gibi iş çeviren herkes olsaydı keşke.",""
"1BF9955D4F1F273C94A8B8868C2274CF","q201b_04d_ligia_with_customer_chat","Hm, tak. Dziękuję.","Hm, evet. Teşekkürler.",""
"0330B2A0492E664C54D41E9BDB431075","q201b_04d_ligia_with_customer_chat","Wiktor?","Wiktor?",""
