"Hash","NodeName","PL","TR","Notes"
"C14C58AE40360FEAE0A750B691BC91E8","q201b_01a_smugglers_hideout_entrance_chat","Te, magik! Podejdź no!","Hey büyücü! Yaklaş bakalım!",""
"827505F64D69A04061A55694A3210FB9","q201b_01a_smugglers_hideout_entrance_chat","Chodźże tu! Jest sprawa.","Gel buraya! İş var.",""
"E94E06794CFC1D3DBF4C05B6CD1D3AC3","q201b_01a_smugglers_hideout_entrance_chat","To tutaj. Ale coś jest nie tak.","Burası. Ama bir şeyler yolunda değil.",""
"D9A4375D4D38FB871633BB94B5E99D9B","q201b_01a_smugglers_hideout_entrance_chat","Przydałyby się dodatkowe rubelki.","Fazladan birkaç ruble fena olmazdı.",""
"86DC66BB47DCDFE6EA588B89A2823FAB","q201b_01a_smugglers_hideout_entrance_chat","Czy warto się złamać? Wszyscy tak robią...","Pes etmeye değer mi? Herkes öyle yapıyor…",""
