"Hash","NodeName","PL","TR","Notes"
"9FBEFB9840630445B6B38988DDEA237A","CinematicNode_Choice_0","Przyznaj, że może ma rację.","Belki haklı olduğunu kabul et.",""
"F205390144937DD977D966965A880F31","CinematicNode_Choice_0","Zaznacz, że nie masz zamiaru uciekać.","Kaçmaya niyetin olmadığını belirt.",""
"ED8BAFBB41051E5A55032C8C99C82129","CinematicNode_Choice_0","1","1",""
"F817115D4FBC2E97E38D81AF9F1AAB0F","CinematicNode_Choice_0","2","2",""
"8CB1D34240AAE3BB5A1BADB8DACE7CFD","CinematicNode_Choice_1","Zapytaj, czy Golem go niczego nie nauczył.","Golem ona hiçbir şey öğretmedi mi diye sor.",""
"CEB51DBF4415E0D0159E839FCE3A3E67","CinematicNode_Choice_1","Wycofaj się dyskretnie.","Sessizce çekil.",""
"8E08E3304181631E83DE469E7E436F01","CinematicNode_Choice_1","1","1",""
"977A61CD4578FA00B00D3E9F787D2368","CinematicNode_Choice_1","2","2",""
"A1D9594146EA3AD4080762B641871EB3","CinematicNode_Choice_2","Zduś strach Mordechaja, aby pomógł rabinowi.","Mordechaj'ın korkusunu söndür ki rabbiye yardım etsin.",""
"89AD4F2D4AD8964CAC611CA3A9B1F38A","CinematicNode_Choice_2","Sprowokuj tłum do walki.","Kalabalığı dövüşe kışkırt.",""
"2AE0613E4B2D3984D7E8D69B673CB8CD","CinematicNode_Choice_2","Zasugeruj, żeby przemówił im do rozumu.","Onlara mantık aşılamasını öner.",""
"0FC991B24568C21332F088864EAD8058","CinematicNode_Choice_2","Dowiedz się, gdzie wyjeżdża.","Nereye gittiğini öğren.",""
"B93BD8B24918A416CBA9989BAD1B5B7C","CinematicNode_Choice_2","Odejdź.","Çekil.",""
"A01E422B43BF91D8B6BCC682D2EBD8E3","CinematicNode_Choice_2","1","1",""
"C84FA7A444E670BFBC1F1497975D9507","CinematicNode_Choice_2","2","2",""
"8861FF714E94918A4463ACBEED272606","CinematicNode_Choice_2","3","3",""
"A3B755914489B45DA9848E9214338310","CinematicNode_Choice_2","4","4",""
"2834EFF64BF9AFF0EE26DFB767D96371","CinematicNode_Choice_2","5","5",""
"0B79CD0D452CE00F3C8FFE91F15D2414","CinematicNode_Response_0","Co tu się dzieje? O kim oni mówią?","Burada neler oluyor? Kimden bahsediyorlar?",""
"6D27B19A4951B369E298B5B992F0CA6B","CinematicNode_Response_0","W ludziach się krew zakotłowała, naczytali się propagandy. Szli po Ariela Rofe, a Feldman ich zatrzymał i boję się go zostawić samego.","İnsanların kanı kaynamış, propaganda okumaktan başka bir şey kalmamış. Ariel Rofe'nin peşine düştüler, Feldman onları durdurdu, onu yalnız bırakmaktan korkuyorum.",""
"67A934564CF53A87C6E085A8CBB2F8D8","CinematicNode_Response_0","Ale ty uciekaj. Oni nie żartują.","Ama sen kaç. Şakaları yok.",""
"D38674DC4F5C6DD22DE3109F0D234E08","CinematicNode_Response_1","...","...",""
"0E2345BB43129D023B717A992ADB248C","CinematicNode_Response_10","Nie zamierzam uciekać. Cokolwiek się zdarzy, stawię temu czoło.","Kaçmaya niyetim yok. Ne olursa olsun karşılayacağım.",""
"213AE0644FD8CB867F49699CF44934BA","CinematicNode_Response_10","Twój ojciec może i podzieliłby tę opnię. Sam nie wiem.","Baban da bu kanıyı paylaşırdı belki. Pek emin değilim.",""
"5B4A95214EE555E133AF1BA6B18564A4","CinematicNode_Response_11","Myślałem, że historia <i>Golema</>, czegoś cię jednak nauczyła.","<i>Golem</> meselesinin sana yine de bir şeyler öğrettiğini sanmıştım.",""
"46FF82E044FE72FDAFC5A395DA3D8B9C","CinematicNode_Response_11","Nauczyła, owszem. Że takich jak ty, trzeba tępić. Jak karaczany.","Öğretti elbette. Senin gibilerin hamamböceği gibi temizlenmesi gerektiğini.",""
"EE10A24B4988A6D211841EA7223F5F6B","CinematicNode_Response_11","Chajat! Przywołuję cię do porządku!","Chajat! Seni hizaya getiriyorum!",""
"FE758AAB4431F6C82061BCA71C5DB11C","CinematicNode_Response_11","Ten! Wiktor Szulski, jest jednym z nich. Brać go.","Bu! Wiktor Szulski, onlardan biri. Yakalayın şunu.",""
"EA6BA58B46C8B71B25DAA6BEB67EEA37","CinematicNode_Response_12","Co robisz w tym tłumie, Chajat?","Bu kalabalığın içinde ne işin var, Chajat?",""
"82A8F13A4518B476704B58B8D44FE4D3","CinematicNode_Response_12","Nie powinieneś tu być. Wyjeżdżam z miasta i tobie też tak radzę. Zanim ktoś zobaczy twoją książkę.","Burada olmamalısın. Şehirden ayrılıyorum, sana da öyle yapmanı tavsiye ederim. Kitabını biri görmeden.",""
"D95958B049224C362997489ED82BB1BF","CinematicNode_Response_13","Warszawa nie jest dobrym miejscem. Dla nikogo.","Varşova iyi bir yer değil. Hiç kimse için.",""
"B6F8FC834892F68EF55D36AD539B84FB","CinematicNode_Response_14","Mówiłem, żebyś stąd uciekał.","Buradan kaç dedim sana.",""
"B4F1B0854ADDCE9EBBF34787566A5D16","CinematicNode_Response_15","Dokąd zamierzasz się udać?","Nereye gitmeyi düşünüyorsun?",""
"2874FD124952CF64F50C68B2D76036CC","CinematicNode_Response_15","Jak najdalej stąd. Mam kuzyna we Lwowie, a później, zobaczymy. ","Buradan olabildiğince uzağa. Lwów'da kuzenim var, sonrasını göreceğiz. ",""
"F0B2B80E4CD1A72A4C7C4FA9F8969A65","CinematicNode_Response_15","Nowy początek?","Yeni bir başlangıç mı?",""
"ED927B584483E42FD8C45E8BB59F94E8","CinematicNode_Response_15","Tak. Chcę zostawić za sobą to miasto, nienawiść i zapomnieć swoje błędy.","Evet. Bu şehri, nefreti geride bırakmak ve hatalarımı unutmak istiyorum.",""
"1FE67BDE4ADF8DF07859DEB84D54AE27","CinematicNode_Response_15","Ty też powinieneś.","Sen de aynısını yapmalısın.",""
"13EFCBE046908AB4611F88BD76AFBACE","CinematicNode_Response_16","Nie musicie dalej szukać żadnego magika, tu jestem.","Daha fazla büyücü aramanıza gerek yok, buradayım.",""
"1533D3064A0C0A95E3761BA0A7AFF2E5","CinematicNode_Response_16","Co ty robisz? Rozniosą cię.","Ne yapıyorsun? Seni paramparça ederler.",""
"8D705AFE4797B44C65E4AEB1D7F4654B","CinematicNode_Response_16","Patrzcie, sam się na stos pcha. Dawać go!","Bakın, kendi ayağıyla ateşe geliyor. Vurun şuna!",""
"C828A4554E4CE6AF7A0B5A86E39EC651","CinematicNode_Response_17","W takim razie to pożegnanie?","O hâlde bu bir veda mı?",""
"DEA0DFA6401A2E7F391B629E6542A6FE","CinematicNode_Response_17","Na to wygląda.","Öyle görünüyor.",""
"4989849E4EFC581812B4FFBCF52C2D6A","CinematicNode_Response_18","Tyle krwi, tyle przemocy...","Bu kadar kan, bu kadar şiddet...",""
"1EC0C31B44670A96E0DD1A83984DA5CD","CinematicNode_Response_18","Tak wyglądają pogromy. Gdybym ich nie zatrzymał, skrzywdziliby kogoś innego.","Pogromlar böyle olur. Onları durdurmasam, başkalarını incitirlerdi.",""
"B3056F934669453378FACDADD1533030","CinematicNode_Response_18","Tak, pewnie masz rację...","Evet, herhâlde haklısın...",""
"C50A4C3A42A7ECF98C2EA5AECF4BF62F","CinematicNode_Response_19","Uważaj na siebie.","Kendine dikkat et.",""
"93BDA73D49A1E3A4D51329ABB6333F27","CinematicNode_Response_19","Dziękuję, że pomogłeś. Ty także bądź ostrożny, synu Stanisława.","Yardım ettiğin için sağ ol. Sen de dikkatli ol, Stanisław'ın oğlu.",""
"CAB2441E402777B2CB97D8B81E9D5ECE","CinematicNode_Response_19","Chajat, zajrzyj do mnie jeszcze, zanim wyjedziesz. Panie Szulski, będę się za pana modlił.","Chajat, gitmeden önce bir kez daha bana uğra. Bay Szulski, sizin için dua edeceğim.",""
"B2A184944A02D5038568A58DA04CC411","CinematicNode_Response_2","Wyzbądź się strachu i pomóż rabinowi. Nie pozwól, żeby inni popełnili twoje błędy. Potrzebują twojego głosu.","Korkundan sıyrıl ve rabbiye yardım et. Başkalarının senin hatalarını yapmasına izin verme. Sesine ihtiyaçları var.",""
"BBFA341D422E1F6A0867569AA6007CA8","CinematicNode_Response_2","Pieprzyć i magika, i rabina! To nasza dzielnica, idziemy!","Hem büyücüye hem rabbiye lanet olsun! Bizim semtimiz, gidiyoruz!",""
"EC90E00C460BEC3D932A5BB85CB0A590","CinematicNode_Response_2","Ty, Aaron, to akurat do żony wrócić powinieneś! Lada chwila rodzić będzie. Nie wstyd ci?","Sen, Aaron, asıl karının yanına dönmen gerek! Her an doğum yapabilir. Utanmıyor musun?",""
"633D959247E8748D256463B726A563F6","CinematicNode_Response_2","Ja... a co z zemstą, za to, co z nami magicy robią?!","Ben... peki ya büyücülerin bize yaptıklarının öcü ne olacak?!",""
"1D632BD947BAFE6A49F562BC13F69EB0","CinematicNode_Response_2","A co ci zrobili? Za co się mścisz? Naczytaliście się ruskich gazet albo ulotek. Ja latami hodowałem nienawiść. Znam ją. Nie znalazłem w niej sprawiedliwości.","Sana ne yaptılar? Neyin öcünü alıyorsun? Rus gazetelerini, broşürlerini okumaktan başka bir şey kalmamış. Ben yıllarca nefret besledim. Onu tanırım. İçinde adalet bulamadım.",""
"DD8A966F430AB3DE267917A159C539FC","CinematicNode_Response_2","Kiedy ta gorączka odpuści, wy zostaniecie z krwią na rękach i wstydem. Nie idźcie tą drogą!","Bu humma geçtiğinde elinizde kan, gönlünüzde utançla kalakalacaksınız. Bu yola sapmayın!",""
"3498A2E347550782A9C3CF839DB690EF","CinematicNode_Response_2","Zemsta, to żadna sprawiedliwość!","İntikam adalet sayılmaz!",""
"D3C7E0D847B973A7C8C396BD247B1AB2","CinematicNode_Response_2","Dość już gniewu. Chodźmy do synagogi, prosić o przebaczenie.","Bu kadar öfke yeter. Hadi sinagoga gidelim, bağışlanma dileyelim.",""
"38FCF855498002D82C1708B51C76E7FD","CinematicNode_Response_20","Uspokójcie się, mówię! Tu jest poświęcona ziemia!","Sakin olun diyorum! Burası kutsal toprak!",""
"F3FD96504E50F25CDFB51F82AB35C737","CinematicNode_Response_20","A magicy tylko ją plugawią. Zrobimy z nimi porządek.","Büyücüler de onu kirletmekten başka bir şey yapmıyor. Onların hakkından geleceğiz.",""
"5C1FD4D54D1BFC471D48098709F239EA","CinematicNode_Response_3","Szulski, obyś zdechł, jak twój ojciec.","Szulski, baban gibi geberesin.",""
"DDF1DB3C47DC4C97C56FAC9A2ADF2217","CinematicNode_Response_3","On się bronił! Przed ludźmi, których ty na niego poszczułeś! Sofera też byś wziął na widły, gdyby żył?","Kendini savunuyordu! Senin üstüne saldığın insanlardan! Yaşıyor olsa Sofer'i de yaba ucuna mı alırdın?",""
"B837233042F2686EFCDFB8BC4676F329","CinematicNode_Response_3","Bronisz go? Ty, sługa swojej gminy? Powinniśmy się go pozbyć! Raz na zawsze.","Sen onu mu savunuyorsun? Cemaatinin hizmetkârı olan sen? Ondan bir kez ve sonsuza dek kurtulmalıyız!",""
"5E3ADE914626CE9166A243ADD4DB3ACC","CinematicNode_Response_3","Nie, nie tędy droga. Skoro na nią wstąpiłeś, to drzwi synagogi są dla ciebie zamknięte.","Hayır, yol bu değil. Bu yola girdiysen, sinagogun kapıları sana kapalıdır.",""
"08E37B224312C653BF3F4996B00EA02F","CinematicNode_Response_3","Niech i tak będzie. Żegnaj, <i>rabi</>.","Öyle olsun. Elveda, <i>rabbi</>.",""
"C34B5BE04FE99352D2FE3F9FBE8F1FE3","CinematicNode_Response_4","Ta dzielnica widziała już dość krwi! Błagam was! <i>Hashem</> patrzy na was i widzi!","Bu semt yeterince kan gördü! Yalvarıyorum size! <i>Hashem</> sizi izliyor ve görüyor!",""
"54E91E6B448BFD16803CE0A764642B2B","CinematicNode_Response_4","Nie, póki ten magik wciąż zipie!","Bu büyücü hâlâ soluk alırken, hayır!",""
"B9A818BC4262685BBDD9D0A460D87B9F","CinematicNode_Response_5","Ci odeszli, ale kto wie, ilu ich jeszcze grasuje po ulicach? Boję się tego, co nadchodzi.","Bunlar gitti, ama sokaklarda daha kaç tanesi dolanıyor kim bilir? Yaklaşandan korkuyorum.",""
"E218E83A4F03C72BEF5E0489DC595C4A","CinematicNode_Response_6","Ci ludzie cię znają. Pewnie też szanują. Nie możesz ich przekonać?","Bu insanlar seni tanıyor. Muhtemelen sayar da. Onları ikna edemez misin?",""
"42B56358424883E96F45AC94CA34D8DC","CinematicNode_Response_6","Raz narzuciłem swoją wolę innym i zobacz, jak to się skończyło. Feldman, mam nadzieję, sobie poradzi.","Bir kez başkalarına irademi dayattım, sonu nasıl oldu gör. Feldman'ın umarım altından kalkar.",""
"F79061694E31AD1558918E9737A1839E","CinematicNode_Response_6","Sam nie wiem.","Pek emin değilim.",""
"AE8FDAEC487532DDDC9884A12A06E19B","CinematicNode_Response_7","Może masz rację. Rozważę to.","Belki haklısın. Bunu düşüneceğim.",""
"252270394CC5792229A0BA85E205F875","CinematicNode_Response_7","Nie zwlekaj. Widzisz, co tu się dzieje.","Oyalanma. Burada neler olduğunu görüyorsun.",""
"CB031639463720029AA191B3BFDA3973","CinematicNode_Response_8","Żegnaj.","Elveda.",""
"4A73596349A8861090BFA8832C1CFA77","CinematicNode_Response_8","Mam nadzieję, że tym razem mówisz to poważnie. Uciekaj stąd.","Umarım bu kez ciddi söylüyorsun. Buradan kaç.",""
"7A39C8E24A7B68B3C4C5EA893A49EF0F","CinematicNode_Response_9","...","...",""
"EA5B2FEE4323E43F659054B7F5BF505F","CinematicNode_Response_9","Część z was tu mieszka, część nie, ale i jedni, i drudzy niech wiedzą, że nienawiść oznacza piekło. Opamiętajcie się.","İçinizden bir kısmı burada oturuyor, bir kısmı oturmuyor, ama ikisi de bilsin ki nefret cehennem demektir. Aklınızı başınıza toplayın.",""
"25B84DE74FFD45279AD23EBE3C61B16B","CinematicNode_Response_9","Thaumaturgowie od lat sprowadzają na dzielnicę nieszczęścia. Nie pamiętasz już, <i>rabi</>?","Tılsımkârlar yıllardır semtin başına dert getiriyor. Hatırlamıyor musun, <i>rabbi</>?",""
"412BBBF64B481E8A78FB17A78658EA71","CinematicNode_Response_9","Mordechaju, proszę. Złóżcie broń, wejdźmy do synagogi i pomódlmy się o przebaczenie.","Mordechaj, lütfen. Silahları bırakın, sinagoga girip bağışlanma için dua edelim.",""
"004FDA1F4E1FEC6F6F522CA52EA763A7","CinematicNode_Response_9","Nie, <i>rabi</>. Musimy zacząć oczyszczać to miasto. Zaczniemy od Rofe.","Hayır, <i>rabbi</>. Bu şehri arındırmaya başlamalıyız. Rofe ile başlarız.",""
