"Hash","NodeName","PL","TR","Notes"
"2BB4CD7547AF1834035681A643173618","q301_03d_countess_samira_chat","Hrabino Lermontowa.","Kontes Lermontowa.",""
"D8635A144BBF0777FB2DE2BE79BFDAA1","q301_03d_countess_samira_chat","Madame Samira, cóż za niespodzianka!","Madam Samira, ne büyük sürpriz!",""
"50F5D74548CCBD4F66DBFD98EEB80720","q301_03d_countess_samira_chat","Powróży mi, madame?","Bana bir fal bakar mısınız, madam?",""
"45679D3042181172FB79658A09D71F5D","q301_03d_countess_samira_chat","Oczywiście, hrabino.","Tabii, kontes.",""
"082365F742C89A2DF1910E9CA7B5A567","q301_03d_countess_samira_chat","Widzę... wielkie niebezpieczeństwo!","Görüyorum... büyük bir tehlike!",""
"EE30E8284E42B61A9A440A9CB45BA117","q301_03d_countess_samira_chat","Co takiego? Mów dziecko, co widzisz?!","Ne diyorsun? Söyle çocuğum, ne görüyorsun?!",""
"4C5672C2407D81BDA038418575C2EDB7","q301_03d_countess_samira_chat"," I hrabinę, ale... szczegóły są zamglone.","Kontesi de, ama... ayrıntılar bulanık.",""
"863C00434F2BE9F148EBD6A258665D96","q301_03d_countess_samira_chat","Madame, proszę wszystko opowiedzieć!","Madam, lütfen her şeyi anlatın!",""
