"Hash","NodeName","PL","TR","Notes"
"1D8F0ED84DA25A0323223E9E1574F51C","q302_03d_magdalena_chat","Umarł, ale żyć będzie! Otwórzcie serca, aby przyjąć nowego mesjasza!","Öldü ama yaşayacak! Yeni mesihi karşılamak için kalplerinizi açın!",""
"181554D74A8DE93CE6DD3D92371AFED9","q302_03d_magdalena_chat","Za dużo bąbelków?","Fazla mı şampanya kaçırmış?",""
"9E4E61BA49EED7890935C597FF7034BA","q302_03d_magdalena_chat","Cicho! Ja myślę, że to może mieć sens...","Sus! Bence bunun bir mantığı olabilir...",""
"FD97CF96415D35DD543A109D176BD169","q302_03d_magdalena_chat","Proszę za mną.","Beni takip edin.",""
"D353AE5746418D640696759BECF88432","q302_03d_magdalena_chat","Nie zamkniecie mi ust! Faryzeusze!","Ağzımı kapatamayacaksınız! Ferisiler!",""
"B1EDC8C140E147136A8E3BB466273141","q302_03d_magdalena_chat","Proszę nie utrudniać.","Lütfen zorlaştırmayın.",""
