"Hash","NodeName","PL","TR","Notes"
"581329244B68577FEA99458B591227B9","smg02_01_ligia_and_dickstein_chats","Droga Ligio, jeszcze raz dziękujemy za gościnę.","Sevgili Ligia, bir kez daha misafirperverliğin için teşekkür ederiz.",""
"34B49C1C47BA940AFA3A6D82A1685733","smg02_01_ligia_and_dickstein_chats","Nie ma o czym mówić, Samuelu.","Rica ederim, Samuel.",""
"1D052DEE479E542BFA9382A39D5A65D1","smg02_01_ligia_and_dickstein_chats","Zrobię, co w mojej mocy, by pomóc.","Yardım etmek için elimden geleni yapacağım.",""
"E63E7E9C42DFBBABBF791DA100C4B918","smg02_01_ligia_and_dickstein_chats","Gdyby nie Wiktor... bardzo nam pomagacie oboje.","Wiktor olmasaydı… ikiniz de bize çok yardım ediyorsunuz.",""
"BE4B2B124E0F26D16F494C9DC36884F0","smg02_01_ligia_and_dickstein_chats","Drobiazg.","Önemli değil.",""
"16CFED80428B98E5D421F5B588EB507B","smg02_01_ligia_and_dickstein_chats","Jest i on.","İşte o da geldi.",""
"41F1B0214227A4DA98A6A791D31D06C9","smg02_01_ligia_and_dickstein_chats","Wiktor?","Wiktor?",""
"A07199FA439E4151B1375EA5E2B27385","smg02_01_ligia_and_dickstein_chats","Wiktorze, wszystko gotowe?","Wiktor, her şey hazır mı?",""
"6751D9374D0B117666D3C8B8B3531299","smg02_01_ligia_and_dickstein_chats","Możemy zaczynać?","Başlayabilir miyiz?",""
