"Hash","NodeName","PL","TR","Notes"
"7A6A0AD04F88AA11F8845AB3964829E9","smg_vset_student_f_02","A mogłam się urodzić głupia. Zachciało mi się nauki.","Salak doğabilirdim. Tutmuş okumak istemişim.",""
"10EF2E7C427495CAC16DB39A0780970B","smg_vset_student_f_02","Nie chciałam być utrzymanką, wolę chodzić do gimnazjum.","Kapatma olmak istemedim, lise tercihim.",""
"20DF22324130788C61F17191CC8038BB","smg_vset_student_f_02","Pan wygląda na oczytanego.","Beyefendi okumuş birine benziyor.",""
"24D42332406AA793D154C784ACC141E1","smg_vset_student_f_02","Ja uważam, że powinni strajkować.","Bence grev yapmalılar.",""
"7A1E3B574A20759DC7C73C84ED4F6503","smg_vset_student_f_02","Najpierw strajki robotnicze, potem prawo do głosowania.","Önce işçi grevleri, ardından oy hakkı.",""
