"Hash","NodeName","PL","TR","Notes"
"72B5C36741090EFE12C216A1F64C7162","smg_vset_commoner_f_02","Synku, czy ty Boga w sercu nie masz?","Oğlum, kalbinde Tanrı yok mu senin?",""
"13A30AF948324B30811EF9A071CD1DFB","smg_vset_commoner_f_02","Dobre kazanie wczoraj ksiądz wygłosił.","Peder dün güzel bir vaaz verdi.",""
"951DDC3141B81CF0220046A237A19810","smg_vset_commoner_f_02","W tej homilii ostatniej, to tym Żydom, <i>thaumatom</> ponawtykał.","Geçen vaazında o Yahudilere, şu <i>thaumat</>lara çatıp durdu.",""
"2A1F50674D00B5E3B01E53AE4A844837","smg_vset_commoner_f_02","Wszędzie się zło lęgnie w człowieku.","İnsanın içinde her yerde kötülük üreyebiliyor.",""
"FDCC4C574D9A81D2FB313187503530A2","smg_vset_commoner_f_02","Licho kuszące zawsze było.","Şer baştan çıkarmaktan asla geri durmadı.",""
