"Hash","NodeName","PL","TR","Notes"
"043A58A0462CC1DB1574FCB101F424A3","smg_vset_commoner_m_03","Gdzie ta knajpa, co jest tylko dla tych, co wiedzą gdzie ona jest?","Şu meyhane nerede, sadece nerede olduğunu bilenler içindi hani?",""
"CDE0C54A472BF6064AAA0D9F64AC06B4","smg_vset_commoner_m_03","Chyba dziś tą widziałem, tą... jak ona ma? Ząb-Krzakowską... Dąb-Zakrzewską!","Sanırım bugün şu… adı neydi? Ząb-Krzakowska… Dąb-Zakrzewska'yı gördüm!",""
"EDA0CFC74292F307F051A79361161A22","smg_vset_commoner_m_03","Dobre recenzje ten Moniuszko nowy ma.","Şu yeni Moniuszko iyi eleştiriler aldı.",""
"8501A35A417DBA3D230F9A8A65591565","smg_vset_commoner_m_03","Byłem w takim, tym. I tam pokazują takie rzeczy, nie uwierzysz!","Bir yere gittim, hani. Orada öyle şeyler gösteriyorlar ki, inanmazsın!",""
"19BC6D0B4AEF92E3AE598389A767E090","smg_vset_commoner_m_03","...ale tak zupełnie do goła. Nawet majtki zdjęła.","…ama tamamen anadan üryan. Külotunu bile çıkardı.",""
"C71011AE46050765656691B69C95745B","smg_vset_commoner_m_03","Teatr to jest jednak sztuka.","Tiyatro yine de bir sanat.",""
