"Hash","NodeName","PL","TR","Notes"
"20FBE4644A853FAC0DAB94B277F2D298","smg_vset_secret_student_f_02","Dickstein ryzykuje dla nas życiem.","Dickstein bizim için hayatını riske atıyor.",""
"89D4B4EC482CA66BB8A87C9CA5F48170","smg_vset_secret_student_f_02","Też kiedyś będę przedsiębiorczynią.","Bir gün ben de iş kadını olacağım.",""
"340ADD8D4186608E2837ECAAD64EB9BC","smg_vset_secret_student_f_02","Kiedyś będziemy się uczyć tego, co chcemy.","Bir gün istediğimizi okuyacağız.",""
"F1AF93164AB7AD5AF18957AEF1A52296","smg_vset_secret_student_f_02","Tomaszewicz-Dobrska zaczęła od leczenia haremu i już od ćwierć wieku praktykuje.","Tomaszewicz-Dobrska harem tedavisinden başladı, çeyrek asırdır hekimlik yapıyor.",""
"E389A2074508B0B835BB11925654A0C4","smg_vset_secret_student_f_02","Nie dali jej nostryfikować dyplomu, bo była kobietą!","Diplomasını denkleştirmediler, kadın diye!",""
"5C99B75747ADBBA78B780D84F69DAC31","smg_vset_secret_student_f_02","Prus się nawet za nią wstawiał.","Onun için Prus bile arabuluculuk yaptı.",""
