"Hash","NodeName","PL"
"8020423F4CDEF7EAAC7D0D8C5AA36FD3","genenc_smc_01_chats","To jasne, że mam rację!"
"29C2D2374178E990FE9ED480AD538529","genenc_smc_01_chats","Zaraz ci tę rację z głowy wytłukę!"
"A46269134FEC0B69913091994A8ECD35","genenc_smc_01_chats","Co, i jeszcze powiesz, że najlepiej u Niedzica?"
"062F4F3B4E993B9127E3CAAEE2F8C1C5","genenc_smc_01_chats","A jak! Najlepsza siwucha tylko tam!"
"2799B1E248A9688DF2010589220BFCBE","genenc_smc_01_chats","Powiedz mu!"
"92319CDF4F9A8426A6E54582A2048926","genenc_smc_01_chats","Aleś mu dogryzł!"
