"Hash","NodeName","PL"
"7239286241238B68550889A06ED19EE8","lw_cm01_02a_wta_headquaters","A kiedy są spotkania WTA?"
"96B1333E4421663E6E515BAFDC49D1FC","lw_cm01_02a_wta_headquaters","Czwartki wieczorem."
"C2D1D4F142DF3F00DF73C28FB1273076","lw_cm01_02a_wta_headquaters","A to nie mogę, mam wtedy brydża."
"2CCB478447219BB759E0ACB07E461F1A","lw_cm01_02a_wta_headquaters","A co to znaczy ""kryptodziałanie depopulizujące""?"
"7F040C6040AE01C1C6F8ACB19AB91367","lw_cm01_02a_wta_headquaters","To spisek wężoludzi zakłócających pole elektromagnetyczne."
"8E23989946FC7572AFDA84AAACB4B890","lw_cm01_02a_wta_headquaters","Czemu pan pozwala się tutaj włóczyć magikowi?"
"5AB499F04A5B0700D736A1AFCC7DDF60","lw_cm01_02a_wta_headquaters","Niech zobaczy, że nie mamy nic do ukrycia."
