"Hash","NodeName","PL"
"64A0E8AE4D32E79FA601639DB4EC8742","lw_POI_PW_fightClub","Sekretna mordownia"
"B4B494AA49A9C20AD0CCD8BE8078C29A","lw_POI_PW_fightClub","Na Powiślu ewidentnie odbywają się jakieś podejrzane praktyki. Muszę się dowiedzieć, o co tu chodzi."
"80F05C514B75F529D64F7C9DE1D1F325","lw_POI_PW_fightClub","A więc tak się bawi Powiśle. Spróbuję znaleźć tą mordownię i zobaczyć to na własne oczy."
"9537D23C4444ABEEBD55E8A8707D5BE3","lw_POI_PW_fightClub","Rozejrzyj się po Powiślu w poszukiwaniu tropów"
"83F03938471571B8E3DFECBF90B81860","lw_POI_PW_fightClub","Odszukaj nocą nielegalną mordownię na Białoskrobniczej 5"
