"Hash","NodeName","PL"
"CCBC5B5D4EF9C59038A059A979B0B137","lw_POI_SMG_countParty","Orientalne przyjęcie u hrabiego"
"BD040FE44EE1EBC9888D7E9014A5AFCD","lw_POI_SMG_countParty","Znalazłem karteczkę, której treść brzmi intrygująco... Czuję, że kryje się za tym jakiś sekret wart zbadania. "
"92020D134970F50B046F14BEFE9F5B0A","lw_POI_SMG_countParty","Tajemnica przyjęcia u hrabiego rozwiązana - mam już adres, nazwisko oraz tajne hasło. Może warto złożyć wizytę gospodarzowi i sprawdzić, co się tam dzieje. Oczywiście tylko w ramach eksperymentu i naukowej dociekliwości."
"D3A0F4C6440F5F7AA3AD4DB41A9C07B5","lw_POI_SMG_countParty","Poszukaj wskazówek związanych z tajemniczą notatką "
"074FB0B0471DB864FF935ABC30B47322","lw_POI_SMG_countParty","Odwiedź hrabiego na Erywańskiej 15 po południu"
