"Hash","NodeName","PL"
"54D531114C22045F66C4D7BA4442B53A","lw_POI_SMG_pianoLiszt","Niezwykły instrument"
"0F80B6064F995C617550348C7EEE44A1","lw_POI_SMG_pianoLiszt","Jan Rocki wydaje się intrygującą osobą. Chyba wpadłem na trop czegoś ciekawego."
"7F6DC1C04AB63F7A1C66F181A1F120FA","lw_POI_SMG_pianoLiszt","Znalazłem zaproszenie na przyjęcie, podczas którego będzie można podziwiać niezwykły fortepian. Czy to oznacza, że mogę się wprosić? Przekonajmy się."
"EB809D074FF46E88E5C0188CD1C287E2","lw_POI_SMG_pianoLiszt","Poszukaj wskazówek związanych z Rockim"
"2E63C44047950822F62CA3B0EC9AF2D8","lw_POI_SMG_pianoLiszt","Wproś się na kolację na Próżnej 10"
