"Hash","NodeName","PL"
"A311E774425E4B33BE7C4ABA19A42C6B","lw_smc02_bar_workers_chat","Nie rób <i>ambarasu,</> baby nie ma."
"86CA26D84FF8823A1E6C109C89457491","lw_smc02_bar_workers_chat","Ta jasne. Jak ma na imię?"
"BDD25F9A43598ECB05EAA3BFC905B026","lw_smc02_bar_workers_chat","Zamknij pysk, tak ma na imię."
"49A4251646B25520B769C7BA356CD32F","lw_smc02_bar_workers_chat"," Brzydkie imię dla dziewczynki."
"155B2D57419553D304E67495413D5D70","lw_smc02_bar_workers_chat","Ja nie... to nie to... a chuj. Polej."
