"Hash","NodeName","PL"
"4846E59746796AF979E7E39A6A718134","pp_vset_sailor_m_01","Eeeej, siup, i butelka rumu."
"B564C87E456B7E81F0B43D9C1D3F1D53","pp_vset_sailor_m_01","<i>I smak waszych ust, warszawskie dziewczyny...</>"
"F780BE69476E031B0153DF95AB0580DD","pp_vset_sailor_m_01","Dobrze zejść z łajby na jakiś czas."
"627FEBA148A9ACD1A88395A26FA3D3BB","pp_vset_sailor_m_01","Te wczorajsze śledzie mi wracają..."
"E3330E094586C2CF8BB6C79C367AA239","pp_vset_sailor_m_01","Nie mogę zasnąć, kiedy nic nie buja."
"E57E90894A7A8CF8F8150F8480170EF2","pp_vset_sailor_m_01","Będę potrzebował większej łodzi."
