"Hash","NodeName","PL"
"1A3B429544F83872EFD3DAA1CB991924","pp_vset_policeman_m_04","Nalot z rana jak śmietana."
"9E1D9BF5422E4CDBC50B879AC2DF7D57","pp_vset_policeman_m_04","Jak im się do dupy dobierzemy, to się skończy."
"68C96A934CB766B3873B168731DCDA6F","pp_vset_policeman_m_04","Jak się dociśnie paru, to się zaraz wszystko znajdzie."
"003D6C5647FB6D80761CF884AB452FBA","pp_vset_policeman_m_04","Każdy by tu swoją matkę sprzedał."
"648B1E9F4D469089AD843A98E57DF6A9","pp_vset_policeman_m_04","Jak tu tak żyć mogą?"
