"Hash","NodeName","PL"
"CFA5E4AB48C45B01AD302AA8F9D0C6F8","pw_vset_worker_m_05","A gdzie tam? Z pół roku będzie."
"4AC5711146AF24137F9E51B06DB69EA7","pw_vset_worker_m_05","Jak się ten czwarty urodził, to czasem wychodzilimy, ale teraz to..."
"995091CA4D89DC33C4CBCEB99DFF0C61","pw_vset_worker_m_05","I jak mam to robić? Z jednej strony dzieciaki, z drugiej teściowie."
"4EB9353A4E1632E4A3D9ED8BBA124D45","pw_vset_worker_m_05","Czasem to do parku wychodzimy."
"C5E345D849F7A9C182A485AF43AA297D","pw_vset_worker_m_05","Ile to można się po krzakach wycierać?"
