"Hash","NodeName","PL"
"E2530D33407B1D7D26A3C78555EA0A90","pw_vset_ring_commoner_m_04","Ale proste to zabójcze. To morderca jest."
"5B5B628A4C7631343282A7AC16AB4FDD","pw_vset_ring_commoner_m_04","I jaki szybki jest, skubaniec."
"9E2F550F4D1FD44BA695A2B9D017ADE0","pw_vset_ring_commoner_m_04","Nóżka, nóżka, zwód i sierpowym."
"7AA312F44FB3ABBED24BFF931C9BDAB2","pw_vset_ring_commoner_m_04","We krwi trzy pierwsze rzędy były."
"ED1AC29D4D7690393B64FD93AF051203","pw_vset_ring_commoner_m_04","I cios, i sierp, i zwód, i cios."
