"Hash","NodeName","PL"
"D01B0CA84DEDE9AD772364939BA78F67","pw_vset_beggar_f_01","A co więcej trza? Szałas, plaża. Jakoś się żyje."
"27C7E43D44BD6E9E3AB44C87E927F286","pw_vset_beggar_f_01","Nawet to błoto jakieś znośne."
"C5BF5D0A4E24104C306B5E80A2563509","pw_vset_beggar_f_01","Wszyscy mi tu spokój dają. I dobrze."
"75AF1548408817F8FCB8ED840A1049AB","pw_vset_beggar_f_01","Ja się nikomu nie narzucam, to i mnie się nikt nie czepia."
"FC32747A4E8B5A39D26DA8860EB3FEF6","pw_vset_beggar_f_01","Do wszystkiego idzie przywyknąć, panie."
"79BD6F284B1CC2A6133B8D95EA3A2F10","pw_vset_beggar_f_01","Widać taka Pana wola, ja się kłócił nie będę."
"12E9F5B442AE1CC90AEC929F64A5D244","pw_vset_beggar_f_01","Ja się nie skarżę, mnie muzyczka w głowie gra."
"15AFDD85441B4BED721C63B623BF038E","pw_vset_beggar_f_01","I tak tańczyć i tańczyć do końca..."
