"Hash","NodeName","PL"
"65FBAED440A7E709BA04D886C8CC8CF7","pw_vset_ring_commoner_m_02","Pewniak, mówię ci, pewniaczysko."
"D59D4E72407A40A251C2418CC6E99544","pw_vset_ring_commoner_m_02","Ja cię oszukam? Ja bym cię oszukał?"
"41634E29411DDE9FE89EC1870303508A","pw_vset_ring_commoner_m_02","A kiedy mówiłem nieprawdę?"
"95AFDF684F876A0A5E9777AC5AF1F22C","pw_vset_ring_commoner_m_02","Ale po co ja bym miał ciebie kłamać?"
"1F1340904B6077341AFCB0A7D65F1210","pw_vset_ring_commoner_m_02","Nikomu nie mówiłem, tylko tobie teraz."
