"Hash","NodeName","PL"
"D9426BFE4A228942AF2B4E898BC2AE6D","CinematicNode_Response_1","Chciałem nadać dwie depesze. Jedną do Warszawy i jedną do Paryża."
"1E822D184F69527799BC9C9D9F52F307","CinematicNode_Response_1","Pan Szulski... Miałem po pana posłać, kiedy woźnica zjawi się po pocztę."
"2DAC4C0F43121AB401801488259FC3A9","CinematicNode_Response_1","Wyrazy współczucia z powodu ojca..."
"43C69CA14AB92032308C54951A58A164","CinematicNode_Response_1","..."
"7298F7D94E16A465ADB7CC892605621A","CinematicNode_Response_1","Czy nadal chce pan coś nadać?"
"04243D3B4352EF70E716AFBB52921D61","CinematicNode_Response_1","..."
