"Hash","NodeName","PL"
"C6C67F2B41FD987DF306E38CF84B4346","q102_02a_abaurycy_outside_chats","Weź głęboki wdech!"
"0898BBBE418EEBD34E6BB7A3AB1BEC23","q102_02a_abaurycy_outside_chats","Właśnie tak pachnie nocne życie Warszawy! Poczuj je, Wiktor! Zachłyśnij się nim!"
"7A22286A41C1E55B520210A0B138FC1D","q102_02a_abaurycy_outside_chats","Bukiet potu, gówna i rzygowin. I szczyn. Podziękuję."
"9BA1863645B42B58F6DFDE9E3AFF37EE","q102_02a_abaurycy_outside_chats","Chodź, zobaczysz prawdziwe oblicze Abaurycego Niedzica! "
"48461F344F3EF097936B6B92F9D995FE","q102_02a_abaurycy_outside_chats","A może i znajdziesz tu to, czego szukasz!"
"21EE56D04D67FFD94E5D7482877F5501","q102_02a_abaurycy_outside_chats","Do środka, no już!"
"4CD2248E4DBBE44C00CD5093BD00649C","q102_02a_abaurycy_outside_chats","Ale to warszawskie szczyny i rzygowiny, przeplatane wonią niezłomności i bohaterstwa!"
"33A1DCE44CC8C0974ADECC93AFC04716","q102_02a_abaurycy_outside_chats","Nie wiedziałem, że z ciebie taki patriota."
"CCA46FAB49A2BB89653A93929CDE62FF","q102_02a_abaurycy_outside_chats","Alboś zapomniał, przyjacielu."
