"Hash","NodeName","PL"
"0942EC0F466A06C1DF8A60AC1A15E333","CinematicNode_Response_1","Wódeczka, beztroska, skrajności, przemoc..."
"C9B6ED024DDE5982E0DBA6941340ADA4","CinematicNode_Response_1","Ptaszysko musi to lubić. I jeszcze pewnie samo podsyca ten chaos."
"8BC2E0034E7FB5A6501514862215738E","CinematicNode_Response_1","Wiktor! Bo tu karniaki idą!"
"CCAC70014AE99C712167C59F14728550","CinematicNode_Response_1","Pióra, dziób, te ślepia... kim jesteś? Nie mogę się skupić..."
"6176AF924A75176E2D00B59BFA91B083","CinematicNode_Response_1","Bo się tam przejdę zaraz!"
"33B3447D45F7E3580E6F268C81A94966","CinematicNode_Response_1","Czy znam kogoś, kto ma wahania nastrojów, skłonność do brawury i lubi się napić?"
