"Hash","NodeName","PL"
"B7F8A0CD4ADAD4266A96F7A4623E98F3","q102_05a_side_bar_entrance_chats","Dziś impreza zamknięta. Tylko dla swoich. "
"972FF7204F422CAD3FEF2E93106A4753","q102_05a_side_bar_entrance_chats","Tylko dla swoich, mówiłem."
"0C4E3B714A0C3A57BF92AEA2DA2FF681","q102_05a_side_bar_entrance_chats","No dobra, wchodźcie."
"067951F5434FC3B936A6A3903F78E4FE","q102_05a_side_bar_entrance_chats","Tylko nie mówcie nic, że się tak dałem porobić, bo robotę stracę... "
"AFD78A004D9F1D6442F387BEE5C7ED6C","q102_05a_side_bar_entrance_chats","No, ja bym cię nie zatrudnił."
