"Hash","NodeName","PL"
"FAA1BCA147CC64590B22EE9DCCDF0FA4","q104_08d_ring_after_fight_chat","Jak to nie wypłacasz?"
"47B81F0B47C01F84CA622F95E35BD24D","q104_08d_ring_after_fight_chat","Dawaj kopiejki, złodzieju!"
"ABCDACB541EE8A7E532204A56FD8A5A0","q104_08d_ring_after_fight_chat","Chłopy! Stawialiście na Barszczyka, a wygrał magik."
"415D2AAD4F373135820D7CB5860A72AF","q104_08d_ring_after_fight_chat","W zastępstwie magik był!"
"2C890C6A45CA919FCE0A128E2AF3F9EF","q104_08d_ring_after_fight_chat","Ale emocje. Gęsią skórkę mam."
"AF308E594F7AC0FD3F13A9B210836088","q104_08d_ring_after_fight_chat","Ten magik to jednak git."
"FE6CD2884CCC5085DFE48BA6C890AF40","q104_08d_ring_after_fight_chat","Swojak, dobry chłop."
