"Hash","NodeName","PL"
"138A614C4479D6B13DD8ABA85029764A","q201b_04e_ariel_ligia_synagogue_chat","Na co czekamy, Szulski?"
"0190CF394F9172989082F0AC7F749EED","q201b_04e_ariel_ligia_synagogue_chat","Nie jestem tu po to, by podziwiać widoki."
"0623A2AC4868B5BE6383BB9290771A6D","q201b_04e_ariel_ligia_synagogue_chat","Możemy to już mieć za sobą, Wiktor?"
"36993FC4490A9318E3D6C2AFCCFB66FA","q201b_04e_ariel_ligia_synagogue_chat","To miejsce przyprawia mnie o dreszcze."
"78B826A247354F15458480A174ED9AA7","q201b_04e_ariel_ligia_synagogue_chat","Zimno mi."
