"Hash","NodeName","PL"
"6442DF66453B5CDE641375B8EFF8556F","CinematicNode_Response_1","Nie chciałeś się pokazywać w takim stanie Ligii."
"7EDD6D2F4F84C55B56D6539249818035","CinematicNode_Response_1","W takim razie to mogła być jedna z moich najlepszych decyzji."
"BEDC53254310EFE5846DA18C5C741300","CinematicNode_Response_1","Patrząc na wydarzenia poprzedniej nocy, być może jedyna słuszna."
"6842D2E14E782905A8E0DBBA26FF8F97","CinematicNode_Response_11","[Wiktor przebudza się w łóżku u Nadarzyńskich. Naprzeciwko siedzi Rasputin.]"
"39D4CD21402F78F60F5F16A0211E1570","CinematicNode_Response_18","Wolałbym się nie budzić do takich widoków."
"7001475D414EDB8A2BEB02A424AA76CC","CinematicNode_Response_19","Moja głowa zaraz eksploduje..."
"26C8CF45439E871B163B2BA4781A6FA5","CinematicNode_Response_21","Będę czekał na ciebie w salonie, a ty wstań i... doprowadź się do ładu."
"CFE748B342A183E3135FDCB60833A482","CinematicNode_Response_21","Musimy porozmawiać."
"51E458C048434047DF431EA89583363B","CinematicNode_Response_22","Pora wstawać. Doprowadź się do ładu, a my porozmawiamy później."
