"Hash","NodeName","PL"
"91D3962A403A487B0823ECA24C6485E9","q302a_journal","Na rozdrożu"
"932A1C5A498F24B12E27A19C2B67091A","q302a_journal","Fałdżej wyraźnie nie ufa Rasputinowi. Niepokoi go relacja, jaką mamy. Zasugerował, abym dowiedział się więcej na temat natury naszej więzi."
"B536B2254D6B0D02B8C1C897CD0FB41C","q302a_journal","Muszę się spotkać z Rasputinem. Lazarew przekazał mi, że znajdę go na Powiślu. Podobno szykuje tam coś wyjątkowego..."
"01C545254FF8A772B57F638D6705C6B0","q302a_journal","Jakie to typowe dla Rasputina - zorganizować wieczerzę pod burdelem. Widzę, że zaprosił nie tylko swych poplecznków, ale i dziennikarzy. Widocznie liczy na rozgłos."
"0CF6A76E44EF3B1C09DEFCB86833F448","q302a_journal","Spotkaj się z Rasputinem u Nadarzyńskch"
"FD883660401846DFD74A84BEB9EBD8FE","q302a_journal","Odszukaj Rasputina na Powiślu"
"AB32CCAF4C7F56D2E940958795A1ADFB","q302a_journal","Dołącz do Rasputina"
