"Hash","NodeName","PL"
"E728EC004CBA10C6B071D8AAE420C30E","smg_vset_student_f_01","Spódnicę zabrudziłam, profesor mnie wyrzuci."
"069603D4436EAB06855571A9D5013399","smg_vset_student_f_01","Notatki mam dobre. Zdam, na pewno."
"9F9D82A04CA5C3FAE500AD8815C896E5","smg_vset_student_f_01","Przynajmniej mogę się uczyć."
"F0E51FBB45370EF44BB8CBB6FD150FED","smg_vset_student_f_01","Ciekawe, czy można zostać thaumaturginią?"
"D01C99964FDBD96247BBEFA741ACA5D5","smg_vset_student_f_01","Papa mówi, że jestem nad wyraz wrażliwa i wyczulona w różnych kwestiach."
