"Hash","NodeName","PL"
"03E0403D434DBA0E0F9069AD55B9CC5C","SMG_vset_client_m_03","Nie wiem, nie wiem. Nie kupuję byle czego."
"63A83F29432FEBC79FAC0AA93E7A6305","SMG_vset_client_m_03","Byle czym się nie zachwycę."
"2C03355F432DD1B5B7BAA18F8DC62A4F","SMG_vset_client_m_03","Widziałem takie w Rzymie. Nie robi wrażenia."
"2AE06F5043E42A1FDC9BA9BD60AC48E2","SMG_vset_client_m_03","Ile to już tu leży?"
"544208D549C370124C670DA095414C99","SMG_vset_client_m_03","W Petersburgu to inna rozmowa jest od razu."
"C10B0C6E42351E6BECED229221BE2FA2","SMG_vset_client_m_03","Ze stylem to się trzeba urodzić."
