"Hash","NodeName","PL"
"08DF8125435FDB52463FA1AEDB005843","smg_vset_student_m_04","Słyszałem plotkę o tajnych kompletach. Może się wybiorę?"
"7D7CC0784676607A09ECCA9ED5083B47","smg_vset_student_m_04","A mogłem sobie nad Wisełką rybki łowić, zamiast zakuwać."
"68D4D3F242EA1E5376073C9AFEFFAA59","smg_vset_student_m_04","Serwus."
"A44425394C7B8F08BCE643A7553B883F","smg_vset_student_m_04","Żaczki moje kochane!"
"DA24EDE94C0107D72A0F198815D924C3","smg_vset_student_m_04","Żaczki i żaczęta, pewnie się zastanawiacie, po co was tutaj zebrałem."
"B2903CB447D6F62EF687B9BDDD8C18B8","smg_vset_student_m_04","To w naszych rękach leży przyszłość nasza i naszych dzieci."
"AE7DD2284AE706AD4B89FCBF01A98792","smg_vset_student_m_04","Nasz naród potrzebuję inteligencji."
"57A50BCA44600E1FFD1F1499D8939033","smg_vset_student_m_04","Wróg dał nam takie możliwości, jakie dał. I nam to wystarczy."
"42FFDDBF4105F49B0FF44FA83EFF05F8","smg_vset_student_m_04","Za Niepodległą, panowie."
