"Hash","NodeName","PL"
"D07659644617A40CB9AA39A1288A1B4F","smg_vset_servant_f_04","Kiedyś to ja służyłam u inteligencji."
"25D30F2B4C2D2380B0A92FB963059AC0","smg_vset_servant_f_04","Ci to tylko Sienkiewicza czytają."
"F9BA4A844C7330338DE246AED3823F79","smg_vset_servant_f_04","Rozpuszczone te bachory, srogo."
"6E589E004D661FA792AB70839B6FEDB0","smg_vset_servant_f_04","Ale ta mała zdolna. Ona na tych skrzypkach pięknie gra."
"45B6C8E7454FAF6E5D16E7AEC2AACDD9","smg_vset_servant_f_04","Już mówię, zostaw to, wyschnie, to się wykruszy."
