"Hash","NodeName","PL"
"F68C1CC44FCE911D2342D3ACB5B960E5","smg_vset_beggar_m_01","Pod kościołem najlepiej, dewoty zawsze co rzucą."
"BEBBC55B43D5EEBBD0E5608993242579","smg_vset_beggar_m_01","Kościół - mój rewir na żebry, pamiętaj sobie."
"9A679A9B4D21E069F25C8DBCB00213C7","smg_vset_beggar_m_01","Klecha mnie raz przegonił, ale nie ze mną te numery."
"67212D9A4AE3C4BA957867BFBC17CC4B","smg_vset_beggar_m_01","Patrz, czy nie idzie jaki nowy."
"2D4C949E4C7291D43B3C548C65AC12D2","smg_vset_beggar_m_01","Więcej nas tu nie trzeba. Bogaty boi się tłumów."
"C155ADE14FDEE0D8B1DACA8D7D10B5FC","smg_vset_beggar_m_01","Miałem kiedyś takiego znajomego."
"953C99AD4CB6BD3B19A71E94508A8762","smg_vset_beggar_m_01","Znaleźliśmy raz trupa, przy dworcu."
"5264E91A43F8D5C41464E781FB7B2BAB","smg_vset_beggar_m_01","I ja pomyślałem wtedy, że trzeba go pochować."
