"Hash","NodeName","PL"
"4F41D6854EB9FA26B45F84985D999690","vset_Wiktor_searching","Rozejrzyjmy się tu."
"A8E6BC9E48BD96CCAF56D5B4562C5A83","vset_Wiktor_searching","W okolicy jest coś... dziwnego."
"6094EF644F3C636C2DD5E59A91B9279D","vset_Wiktor_searching","Czyżbym wyczuwał...?"
"4DFA72094EF986955028B7B153A5C251","vset_Wiktor_searching","Czujesz to? Zapach tajemnicy."
"1173D6A649D3DA6CEDC23DB15AC10C41","vset_Wiktor_searching","Wyczuwam... No właśnie, co?"
"E73841FF4B69EEC73C71A986C1DDD6C8","vset_Wiktor_searching","Co my tu mamy?"
"E9DADA5842F4941D8F0EFDB9A5630F5C","vset_Wiktor_searching","Thaumaturgia mnie nie myli. Coś tu jest."
"19EC5FAB406E4A68F8FBFDAC028009C0","vset_Wiktor_searching","Coś poczułem. Gdzie to jest...?"
